微博id,发布者,发布者id,微博正文,原始图片url,发布位置,发布时间,发布工具,点赞数,转发数,评论数
IofCfemBS,联新国际医疗上海禾新医院,6821351995,【婴儿如何确诊肺炎？】一是通过呼吸确诊，婴儿如果患有肺炎的时候，呼吸会比较不规律和特别急促，甚至有些婴儿还会出现咳嗽的情况，妈妈可以观察婴儿的嘴巴和鼻子，周围会出现发青程度不一的现象。婴儿患有肺炎的时候，睡眠质量也不是很好。妈妈在婴儿睡觉的时候倾听肺部，如果有滋滋的声音，就可能患有肺炎。二是吐泡沫，婴儿患有肺炎，初期会出现吐泡沫的症状，这也是婴儿咳嗽时候的现象，婴儿会一直吐泡沫，还伴有精神状态不良，总是烦躁不安或是哭泣的情况。妈妈给婴儿吃奶的时候还会出现不吃奶或是呛奶的现象，由此可以判断出婴儿患有肺炎。三是病毒感染，肺炎属于流行的病毒感染，大多数婴儿患有肺炎，是由于病毒感染造成的。有些病毒如果传染上了就很快患有肺炎，并且对婴儿身体免疫系统产生严重的破坏。,无,无,2020-01-06 18:12,微博 weibo.com,3,0,0
IofB5qaFY,无线徐州,2515652420, 【，5个你最关心的问题都在这】为什么今年武汉市会发现“不明原因的病毒性肺炎”，怎样定义“不明原因的病毒性肺炎”？为什么病例数量会增加？如何防范？针对武汉不明原因病毒性肺炎情况，疾控专家、武汉市疾病预防控制中心主任李刚对群众关心的问题一一回应↓↓转发了解！,无,无,2020-01-06 18:10,微博 weibo.com,1,0,0
IofAUsFZN,rzg00523,7309322446,"我分享了【武汉市疾控中心主任：我市不明原因的病毒性肺炎防控工作正有序进行】, 快来看吧！ | 武汉市疾控中心主任：我市不明原因的病毒性肺炎防控工作正有序进行 ",无,无,2020-01-06 18:09,小米浏览器,0,0,0
IofACc5xU,荆楚网,1895394815,【，5个你最关心的问题都在这,无,无,2020-01-06 18:08,微博 weibo.com,3,0,0
IofzvjxVT,露丝小师哥,5800156746, 患者数量为何有所增加？武汉市疾控中心主任解答不明原因肺炎防控工作患者数量为何有所增加？武汉市疾控中心主任解答不明原因肺炎防控工作 来自 ,无,无,2020-01-06 18:06,腾讯新闻客户端,0,0,0
IofzovP2r,南京晨报,2188202475,【，5个你最关心的问题都在这】为什么今年武汉市会发现“不明原因的病毒性肺炎”，怎样定义“不明原因的病毒性肺炎”？为什么病例数量会增加？如何防范？针对武汉不明原因病毒性肺炎情况，疾控专家、武汉市疾病预防控制中心主任李刚对群众关心的问题一一回应↓↓转发了解！ by人民日报,无,无,2020-01-06 18:05,微博 weibo.com,1,1,0
IofzouKFz,哥的世界哥主宰,6449148205,武汉市不明原因肺炎最新通报：已排除SARS等病原  ,无,无,2020-01-06 18:05,科普中国,0,0,0
Iofz2lfr9,新西兰联合报,1926707902,注意衛生! 香港再多6宗武漢返港後出現肺炎等徵狀的懷疑個案，總數增至21宗............ ,无,无,2020-01-06 18:05,微博 weibo.com,1,0,0
IofyGvsyz,德阳商务,1009622001,【，5个你最关心的问题都在这】为什么今年武汉市会发现“不明原因的病毒性肺炎”，怎样定义“不明原因的病毒性肺炎”？为什么病例数量会增加？如何防范？针对武汉不明原因病毒性肺炎情况，疾控专家、武汉市疾病预防控制中心主任李刚对群众关心的问题一一回应↓↓转发了解！   ,无,无,2020-01-06 18:04,HUAWEI Mate 20 Pro,0,0,0
Iofyz9cmr,露丝小师哥,5800156746, 世卫组织就事件发声：不建议对中国实施旅行贸易限制世卫组织就事件发声：不建议对中国实施旅行贸易限制 来自 ,无,无,2020-01-06 18:03,腾讯新闻客户端,0,0,0
Iofy3wk6d,风影水印,1582959753,武汉市疾控中心主任：我市不明原因的病毒性肺炎防控工作正有序进行武汉市疾控中心主任：我市不明原因的病毒性肺炎防控工作正有序进行 ,无,无,2020-01-06 18:02,iPhone客户端,1,0,0
IofwQ9ODh,人民日报,2803301701,【，5个你最关心的问题都在这】为什么今年武汉市会发现“不明原因的病毒性肺炎”，怎样定义“不明原因的病毒性肺炎”？为什么病例数量会增加？如何防范？针对武汉不明原因病毒性肺炎情况，疾控专家、武汉市疾病预防控制中心主任李刚对群众关心的问题一一回应↓↓转发了解！ ,无,无,2020-01-06 17:59,微博 weibo.com,3099,665,698
Iofw4fO8G,烟火---尘埃,5655954775,武汉市不明原因肺炎最新通报：已排除SARS等病原  ,无,无,2020-01-06 17:57,科普中国,0,0,0
IofvoCbgI,威海科技,2345219597,武汉最新通报！不明原因病毒性肺炎诊断患者44例2020-01-04 09:57:19　来源: 科技日报 作者: 代小佩 武汉市卫生健康委员会网站1月3日消息，2019年12月以来，武汉市卫健委开展呼吸道疾病及相关疾病监测，发现不明原因的病毒性肺炎病例，病例临床表现主要为发热，少数病人呼吸困难，胸片呈双肺浸润性病灶。截至2020年1月3日8时，共发现符合不明原因的病毒性肺炎诊断患者44例，其中重症11例，其余患者生命体征总体稳定。目前所有病例均在武汉市医疗机构接受隔离治疗，已经追踪到121名密切接触者并行医学观察，密切接触者的追踪工作仍在进行中。流行病学调查显示，部分病例为武汉市华南海鲜城经营户。截至目前，初步调查表明，未发现明显的人传人证据，未发现医务人员感染。病原鉴定（包括核酸检测和病毒分离培养）和病因溯源工作正在进行中，已排除流感、禽流感、腺病毒感染等常见呼吸道疾病。疫情发生后，国家和省卫生健康委高度重视，派出工作组和专家组赴武汉市，指导当地开展疫情应对和处置工作。武汉市卫生健康委在全市医疗机构开展相关病例搜索和回顾性调查，已完成对华南海鲜城的环境卫生处置工作，进一步的卫生学调查正在进行中。,无,无,2020-01-06 17:56,专业版微博,0,1,3
IofvmvEro,梦小涔,5909961498,    不管是什么疫情，出门记得戴口罩，保护好自己，总没有错。,无,#武汉生活#,2020-01-06 17:55,iPhone客户端,1,0,0
Iofuxorx0,筠jie柠檬可乐,5215764172,"       很多人不爱吃胡萝卜，偏偏印度有种甜品就是胡萝卜做的，里面还有腰果仁。胡萝卜做甜品也很好吃呢！等会我找找看，有没有。洋葱$1(3磅), 做Pizza的白奶酪丝$2元一袋(半磅), 名牌黄油$2.49一磅, 下面几样我没买,是看了物价牌: 加州橙子$0.49一磅,柠檬$1(10个)一袋,这两样很多家都有种",无,无,2020-01-06 17:53,微博 weibo.com,0,0,0
IoftIiXn9,日光岩上的猫,6621892914,『武汉市疾控中心主任：我市不明原因的病毒性肺炎防控工作正有序进行』武汉市疾控中心主任：我市不明原因的病毒性肺炎防控工作正有序进行 ,无,无,2020-01-06 17:51,HUAWEI P20 Pro,0,0,0
IofsYcGZV,邀清风xx,6666445609,是我弟弟第一次执行任务，就被你给杀了！我当时就说过，我会报仇的！”娄清溪冷冷的看着他。 　　“你有着大把的机会能够报仇，为什么要  ,无,无,2020-01-06 17:50,微博 weibo.com,0,0,0
IofqZAcJ3,凯文00,5124590538,针对我市不明原因的病毒性肺炎情况，记者就群众关心的有关问题，专访了疾控专家、武汉 武汉市疾控中心主任：不明原因的病毒性肺炎防控工作正有序进行 ,无,无,2020-01-06 17:45,荔枝新闻,0,0,0
IofqWBT2G,微博公开课,5910012528,【最新消息！武汉不明原因肺炎排除SARS病原】5日，武汉卫健委通报：截至1月5日8时，武汉市共报告符合不明原因的病毒性肺炎诊断患者59例，其中重症患者7例，其余患者生命体征总体稳定，目前所有患者均在武汉市医疗机构接受隔离治疗。已排除流感、禽流感、腺病毒、传染性非典型肺炎（SARS）和中东呼吸综合征（MERS）等呼吸道病原，病原鉴定和病因溯源工作仍在进一步进行中。 ,无,无,2020-01-06 17:45,微博云剪,1,0,0
IofoCqNDn,香港文匯網,2632236847,【港中大开学日学生戴口罩防疫 内地生：无需过分担心】昨日香港中文大学联合书院伯利衡宿舍一名来自武汉的内地生怀疑感染不明肺炎，随后查明该生对腺病毒及已知冠状病毒呈阳性反应，并无肺炎。今日(6日)中大开学，有大批学生配戴口罩，校园巴士候车处也有展台免费派发各式防护口罩。内地生研究生何同学则表示，校方已派人消毒过相关宿舍区域，并提供口罩、酒精搓手液给宿生使用，自身也会注意相关防护措施，不担心有关疫情会在校内传播，认为市民大众毋须过分恐慌。,无,无,2020-01-06 17:39,专业版微博,168,8,84
IoflOoCgw,安馨要快乐,6220354595,武汉市疾控中心主任：我市不明原因的病毒性肺炎防控工作正有序进行武汉市疾控中心主任：我市不明原因的病毒性肺炎防控工作正有序进行 ,无,无,2020-01-06 17:32,iPhone客户端,0,0,0
IofkPeht3,江北检察,2972503342,【武汉市疾控中心主任：我市不明原因的病毒性肺炎防控工作正有序进行】近日，针对我市不明原因的病毒性肺炎情况，记者就群众关心的有关问题，专访了疾控专家、武汉市疾病预防控制中心主任李刚。对于病例数量为何有所增加、为什么要对患者进行隔离治疗等问题，李刚一一进行了解读。详情请戳↓↓↓ ,无,无,2020-01-06 17:29,iPhone客户端,0,1,0
IofkrAe2x,早安江苏JSBC,1746072563,【最新消息！】5日，武汉卫健委通报：截至1月5日8时，武汉市共报告符合不明原因的病毒性肺炎诊断患者59例，其中重症患者7例，其余患者生命体征总体稳定，目前所有患者均在武汉市医疗机构接受隔离治疗。已排除流感、禽流感、腺病毒、传染性非典型肺炎（SARS）和中东呼吸综合征（MERS）等呼吸道病原，病原鉴定和病因溯源工作仍在进一步进行中。 ,无,无,2020-01-06 17:29,微博云剪,0,0,0
Iofk5p4JS,阜阳检察,5170900370,【最新消息！】截至2020年1月5日8时，武汉共报告符合不明原因的病毒性肺炎诊断患者59例，其中重症患者7例，其余患者生命体征总体稳定，目前所有患者均在武汉市医疗机构接受隔离治疗，无死亡病例。在59例患者中，病例最早发病时间为2019年12月12日，最晚发病时间为12月29日；已经追踪到163名密切接触者并行医学观察，密切接触者的追踪工作仍在进行中。流行病学调查显示，部分患者为武汉市华南海鲜城（华南海鲜批发市场）经营户。截至目前，初步调查表明，未发现明确的人传人证据，未发现医务人员感染。已排除流感、禽流感、腺病毒、传染性非典型肺炎（SARS）和中东呼吸综合征（MERS）等呼吸道病原。病原鉴定和病因溯源工作仍在进一步进行中。,无,无,2020-01-06 17:28,360安全浏览器,3,1,1
IofjDAGmi,深圳日报-英文,2588693210,"【已排除SARS病原！武汉发现不明原因病毒性肺炎59例】A total of 59 viral pneumonia cases of unknown cause had been reported in Wuhan, capital of central China's Hubei Province, by Sunday morning, local health authorities said late Sunday.All the patients have been put in quarantine, with the number in serious condition falling to seven from 11 after treatment and the others in stable condition, the Wuhan Municipal Health Commission said in a statement.The tests on the exact pathogens and the investigation over the cause of the infections are underway. Influenza, bird flu, adenovirus, SARS (Severe Acute Respiratory Syndrome) and MERS (Middle East Respiratory Syndrome) have been ruled out, the statement said.A preliminary investigation showed that there have been no clear evidence of human-to-human transmission and no reports of infections among medical staff, it said.Some of the patients, who fell ill with pneumonia between Dec. 12-29, are sellers from a local seafood wholesale market that has been temporarily shut down, said the statement.A total of 163 close contacts have been put under medical observation and they have shown no abnormal symptoms including fever. Local authorities are still searching for more close contacts. (Xinhua)",无,无,2020-01-06 17:27,搜狗高速浏览器,0,1,0
IofjikJg2,黑龙江-平安黑龙江,6259484379,【病例数量为何会增加？武汉疾控中心这样回应…】针对武汉市不明原因的病毒性肺炎情况，记者就群众关心的有关问题，专访了疾控专家、武汉市疾病预防控制中心主任李刚。,无,无,2020-01-06 17:26,iPhone客户端,2,1,0
Iofj9b3lu,Cocoyun1997,5583834458,武汉的不明肺炎，至今不知原因，才是最可怕的。香港今日已经通报16例了。内地城市，除了武汉，无（谁信？）2003年至今，还是一点儿长进没有。 ,无,无,2020-01-06 17:25,iPhone客户端,0,0,0
Iofj8iuQh,界面新闻,5182171545,【为什么武汉市不明原因肺炎病例数量有所增加】扩大了不明原因的病毒性肺炎病例的搜索范围，组织专家依据诊疗方案对搜索的病例进行了诊断排查。目前，随着搜索范围的扩大，对现有病例的回顾性调查的深入，对纳入监测病例排查的持续开展，是患者数量增加的主要原因。预计随着工作开展，病例数量还会增加,无,无,2020-01-06 17:25,微博 weibo.com,17,6,4
Iofj01m7x,咘叮小档家,6998433793,希望这种抓到能重判吧，犯罪成本过低每天都有吃出那种未知病毒的风险。 ,无,无,2020-01-06 17:25,无,0,0,0
IofiTwgka,经视直播官方微博,1798653494,【病例数量为何会增加？武汉疾控中心这样回应…】针对武汉市不明原因的病毒性肺炎情况，记者就群众关心的有关问题，专访了疾控专家、武汉市疾病预防控制中心主任李刚。,无,无,2020-01-06 17:25,微博 weibo.com,3,0,1
IofiihxbU,阿超_港媒视点,2473675252,武汉通报不明原因肺炎：发现59例 重症7例 已排除SARS病-香港商報  ,无,无,2020-01-06 17:23,HUAWEI Mate 9 Pro,3,1,0
IofhxjGEO,fancy566,6298018270,武汉市疾控中心主任：我市不明原因的病毒性肺炎防控工作正有序进行武汉市疾控中心主任：我市不明原因的病毒性肺炎防控工作正有序进行 武汉 ,无,无,2020-01-06 17:21,iPhone客户端,0,0,0
IofgNdH42,华声在线,2288064900,【：因为调查和搜索范围不断扩大】针对武汉市不明原因的病毒性肺炎情况，武汉市疾病预防控制中心主任李刚称，防控工作正有序进行，并在全市医疗机构开展相关病例搜索和回顾性调查。针对市民对通报的病例数量增加的疑问，李刚说，“搜索范围的扩大，对现有病例的回顾性调查的进一步深入，对纳入监测病例排查的持续开展，是患者数量增加的主要原因。预计随着相关工作开展，病例数量还会有所增加。”截至1月5日8时，武汉报告符合不明原因的病毒性肺炎诊断患者59例，其中重症患者7例。 （中国日报 记者 周荔华）,无,无,2020-01-06 17:20,微博 weibo.com,0,0,1
Ioffb4CQ9,超级宇宙巨无霸S,1968296570,新加坡证实爆首宗不明肺炎！3岁女童曾到过武汉 ,无,无,2020-01-06 17:16,荣耀Play 让快更快,3,0,3
IofdNopY4,山东中公优就业,6352274233,  1月6日，星期一，农历腊月十二1.时隔20年，银行存款准备金率重启6％时代，今日正式执行。2.珠海3.5级地震，港珠澳大桥有震感，专家：对大桥结构不会造成影响。3.广东明确：占用消防通道最高罚款5万，让消防车不再被“卡” 。4.武汉市卫健委：报告不明原因肺炎59例，已排除SARS等；5.快递员国家职业技能标准颁布，设置五个等级。6.政府带头，密云39个单位将开放停车场供居民错时停车。7.4.88元！“中国最赚钱高铁”京沪高铁300亿打新，1月6日开启。8.日本航空自卫队将首次改名，新名字是“航空宇宙自卫队”  。9.首次落地非洲！风云卫星接收处理系统交付莫桑比克国家气象局，有效提升其天气预报、防灾减灾能力。10.埃及最古的阶梯金字塔将于今年第一季度正式重启开放。11.法国大罢工将满月：毫无“退烧”迹象，警民再起冲突。12.不要战争！美70多城举行反战示威活动，吁美撤出中东。,无,无,2020-01-06 17:12,微博 weibo.com,1,0,0
IofcA22O4,狮子座的xm01,6258321526,"我在看：【武汉为何现""不明原因病毒性肺炎""?市疾控中心回应】  武汉为何现""不明原因病毒性肺炎""?市疾控中心回应 ",无,无,2020-01-06 17:09,新浪新闻客户端,0,0,0
Iofcle82q,阿Cai要怀挺,1792949795,武汉人好像都不怕事啊！！！出门戴口罩的人是一点也不多[捂脸]！！！1月1号，发布武汉发现不明原因非典型肺炎通报，接诊病例24例。1月3号，更新病例数为44例，121人隔离观察。1月5号，更新病例数为59例，163人隔离观察。我像个老母亲似的给我的老母亲普及知识，给她准备口罩，嘱咐她少去人流聚集地，要过年了，小心预防一下！她觉得我是在害她，一副没见过世面的样子。我……子女之爱母，则为之计深远！操碎了一个老母亲的❤ [捂脸],无,无,2020-01-06 17:09,vivo X20全面屏手机,1,0,3
Iofckm891,囍出望一,1636351805,我分享了  的头条文章 鼠年凶兆？网传武汉不明原因肺炎疑似来自野生旱獭土拨鼠 ,无,无,2020-01-06 17:09,iPad mini,3,0,0
IofcguHkm,新浪湖北健康频道,2049435632, 【世卫组织就事件发声：不建议对中国实施旅行贸易限制】1月5日，世界卫生组织就武汉不明原因肺炎事件发布通报，“根据目前掌握的信息，不建议对中国实施任何旅行或贸易限制”。通报显示，2019年12月31日，世界卫生组织中国办公室获悉了湖北省武汉市发现了不明病因肺炎病例。1月1日，世界卫生组织要求中国政府提供进一步的资料，以评估风险。根据目前掌握的资料，“不建议对旅客采取任何特殊措施；如果旅行期间或旅行后出现呼吸系统疾病症状，建议旅客就医并告知医护人员其旅行经历。”   ,无,无,2020-01-06 17:08,iPhone X,1,0,1
IofcaBHEC,囍出望一,1636351805,『一騳千囍_新浪博客』鼠年凶兆？网传武汉不明原因肺炎疑似来自野生旱獭土拨鼠 ,无,无,2020-01-06 17:08,iPad mini,3,0,0
IofbjphQe,茉莉花卡卡酱,5998996605,"       We build up our heroes , just to tear them down.（我们创造英雄，只为了毁灭他们。）附图Jim Parsons ",无,无,2020-01-06 17:06,微博 weibo.com,1,0,0
IofbgrBBs,柑子竹,1861909322,我分享了  的头条文章 鼠年凶兆？网传武汉不明原因肺炎疑似来自野生旱獭土拨鼠 ,无,无,2020-01-06 17:06,iPhone客户端,1,0,0
IofaQr9Zf,柑子竹,1861909322,鼠年凶兆？网传武汉不明原因肺炎疑似来自野生旱獭土拨鼠 鼠年凶兆？网传武汉不明原因肺炎疑似来自野生旱獭土拨鼠 ,无,无,2020-01-06 17:05,bShare分享,0,0,0
IofaLa7Qh,柑子竹,1861909322,『分享到微博-微博-随时随地分享身边的新鲜事儿』鼠年凶兆？网传武汉不明原因肺炎疑似来自野生旱獭土拨鼠 ,无,无,2020-01-06 17:05,iPhone客户端,0,0,0
IofaHyyZK,维运公盼莉ep,6709315955,阳阻止得了澹台星火，却阻止不了其余澹台一脉的众人下跪，这一跪，他们都是心甘情愿。 　　澹台安天此时  ,无,无,2020-01-06 17:05,微博 weibo.com,0,0,0
IofasbRI5,高德红外sz002414,6501690851,高德红外 sz002414 投资者提问：董秘你好，武汉非典型肺炎病例持续增多，事件持续发酵，请问高德截...，点击链接查看更多->  ,无,无,2020-01-06 17:04,微博股票,0,1,0
Iof8ZvpMx,奶妈56223712,7029428397,为何不明原因肺炎病例数量有所增加？武汉疾控中心回应 为何肺炎病例数量有所增加？武汉疾控中心主任：搜索范围扩大 ,无,无,2020-01-06 17:00,分享按钮,0,0,0
Iof6r6Muh,今日鲈乡,1144559463,患者数量为何有所增加？武汉市疾控中心主任解答不明原因肺炎防控工作患者数量为何有所增加？武汉市疾控中心主任解答不明原因肺炎防控工作 来自 ,无,无,2020-01-06 16:54,Android,0,0,0
Iof6ckTah,1zuohong67,1649755443,为何不明原因肺炎病例数量有所增加？武汉疾控中心回应，严防死守，不能扩散 为何肺炎病例数量有所增加？武汉疾控中心主任：搜索范围扩大 ,无,无,2020-01-06 16:53,分享按钮,0,0,0
Iof5ui77n,上岸星河,5263199316,武汉市疾控中心主任：我市不明原因的病毒性肺炎防控工作正有序进行  ,无,无,2020-01-06 16:52,HUAWEI Mate 30,0,0,0
Iof4AcKaM,用户7244270987,7244270987,武汉市不明原因肺炎最新通报：已排除SARS等病原  ,无,无,2020-01-06 16:49,科普中国,0,0,0
Iof411msM,陈沁桓陈玺铭,2748949021,"我在看：【武汉为何现""不明原因病毒性肺炎""?市疾控中心回应】  武汉为何现""不明原因病毒性肺炎""?市疾控中心回应 ",无,无,2020-01-06 16:48,新浪新闻客户端,0,0,0
Iof3AoBPX,用户6551884608,6551884608,我在看：【武汉发现不明原因肺炎患者59例 已排除SARS病原】   ,无,无,2020-01-06 16:47,新浪新闻客户端,0,0,0
Iof34wQxT,0斯人也0,1774481472,武汉市不明原因肺炎最新通报：已排除SARS等病原  ,无,无,2020-01-06 16:46,科普中国,1,0,0
Iof30F72m,用户6551884608,6551884608,"我在看：【武汉为何现""不明原因病毒性肺炎""?市疾控中心回应】  武汉为何现""不明原因病毒性肺炎""?市疾控中心回应 ",无,无,2020-01-06 16:46,新浪新闻客户端,0,0,0
Iof2x5DVL,深圳小天,1112928761,被穿保护衣救护员连夜送入院隔离的港中大女生，证实与无关。香港中文大学一名女生之前曾前往武汉，12月29日回港，4日感不适，发烧及有上呼吸道感染症状，曾自行到深圳的医院跟进检查。该同学傍晚回到宿舍，在严密保护(看图)的救护人员陪同下，被送往威尔斯亲王医院治理。同宿舍其他女生也被送院进行检验。港中大按照港卫生部门指引加强防疫措施据港媒NOW新闻，初步化验结果是常见病毒，与无关。,无,无,2020-01-06 16:44,深圳小天超话,460,15,119
Iof1sjCLm,cukeh,5305428550,为何不明原因肺炎病例数量有所增加？武汉疾控中心回应 为何肺炎病例数量有所增加？武汉疾控中心主任：搜索范围扩大 ,无,无,2020-01-06 16:42,分享按钮,0,0,0
Iof1k4aGn,用户gdtm8usojy,1045384224,武汉市不明原因肺炎最新通报：已排除SARS等病原武汉市不明原因肺炎最新通报：已排除SARS等病原  ,无,无,2020-01-06 16:41,iPhone客户端,0,0,0
Iof1jrBHH,枣庄市中区检察院,5465305079,发布了头条文章：《武汉卫健委通报不明原因肺炎情况：已排除SARS》  武汉卫健委通报不明原因肺炎情况：已排除SARS ,无,无,2020-01-06 16:41,微博 weibo.com,0,0,0
Iof0RmLg9,朱力芳,1777939053,为何不明原因肺炎病例数量有所增加？武汉疾控中心回应 为何肺炎病例数量有所增加？武汉疾控中心主任：搜索范围扩大 ,无,无,2020-01-06 16:40,分享按钮,2,0,1
IoeZzD9EG,丁香妈妈App,5500173487,【武汉不明原因肺炎诊断患者增至 59 例，家长最关心的 7 个问题一次说清】截至2020年1月5日8时，武汉共报告符合不明原因的病毒性肺炎诊断患者59例，其中重症患者7例，其余患者生命体征总体稳定，无死亡病例。武汉不明原因肺炎，事情已过了近一周。相信大家都会比较焦虑，有很多疑惑想要有人解答。丁香医生和丁香妈妈为您整理了 7 个问题，希望大家能够冷静、理性的看待此次事件，静待后续调查结果。,无,无,2020-01-06 16:37,专业版微博,9,9,3
IoeZjDXOg,锌想事丞,3965758293,武汉市疾控中心主任：我市不明原因的病毒性肺炎防控工作正有序进行武汉市疾控中心主任：我市不明原因的病毒性肺炎防控工作正有序进行 ,无,无,2020-01-06 16:36,iPhone客户端,0,0,0
IoeYksmJP,肿瘤学狼医生,2391614190,发布了头条文章：《武汉不明原因肺炎已排除SARS病原，那么，要喝板蓝根提高免疫力吗》    武汉不明原因肺炎已排除SARS病原，那么，要喝板蓝根提高免疫力吗 ,无,无,2020-01-06 16:34,微博 weibo.com,4,0,3
IoeYfrDuZ,英语陪伴成长,6862082268,武汉近日被流感，肺炎，雾霾，阴雨笼罩，今天乘着大雨过后，带着他去河边遛遛！ 武汉 ,无,#武汉#,2020-01-06 16:34,OPPO R15 梦镜版,0,0,0
IoeXuryMm,一个博为,6444722220,武汉市不明原因肺炎最新通报：已排除SARS等病原  ,无,无,2020-01-06 16:32,科普中国,0,0,0
IoeX8m1IH,楚天都市报,1720962692,【不明肺炎病例数量为何增加？官方解释来了！】为什么今年武汉市会发现“不明原因的病毒性肺炎”？病例数量为何会增加？当前病原检查结果是怎样的？如何有效预防病毒性肺炎？近日，针对武汉市不明原因的病毒性肺炎情况，记者专访武汉市疾控中心，疾控专家、武汉市疾病预防控制中心主任李刚给出答复。,无,无,2020-01-06 16:31,微博 weibo.com,62,17,19
