微博id,发布者,发布者id,微博正文,原始图片url,发布位置,发布时间,发布工具,点赞数,转发数,评论数
IomJJwi8h,yunice-鱼,1660005032,鹅子重感冒闺女支气管肺炎我太难了这些天被磨到没脾气终于终于鹅子快好了闺女也可以自己玩一会去了不再时时刻刻哭哭啼啼的了,无,无,2020-01-07 12:20,HUAWEI nova 3,1,0,0
IomJJhTFJ,血姨_,1571159025, 希望平安度过 血姨_的微博视频 ,无,无,2020-01-07 12:20,iPhone客户端,1,0,6
IomJwxoP8,淡然减脂辟谷闪瘦laura,6643269171,最近孩子住院的特别多！刚出生的宝宝没有住院史，请抓紧为孩子上保险！因为一旦有住院史，如、心肌炎买保险将很麻烦，要么拒保🙏要么延期🙏要么加费🙏要么责任除外🙏……所以在孩子出生健康时一定储备好保险！ 威海·海景花园小区 ,无,无,2020-01-07 12:20,疾速双摄 魅蓝 Note6,0,0,0
IomGm2zxR,潇洒走一回6503917329,6503917329,第3️⃣种：舌苔又厚又黄  积食化热，心肺火旺，容易引起扁桃体发炎，发烧，咳嗽，，甚至便秘！  ,无,无,2020-01-07 12:12,HUAWEI P30,0,0,0
IomFEB7Qx,五季豆儿,2654474920,最近宝宝生病了，前两天开了药吃了三天不见好转，昨天又去了医院，挂了普内，当时医生听了肺，没有查血，没有照片，说这个可能是，先吃三天消炎药试试，真的说的是试试，然后问他家里那些药还吃吗，说是可吃可不吃，最后又说之前那个药不吃，先吃这个三天试试，三天后不行就输液，临走的时候我告诉他家里有一种消炎药，他给我退了，然后说十几块，希望吃得好，好吧，我家的小白鼠，祝你早日康复！,无,无,2020-01-07 12:10,Juan's iPhone 8 Plus,0,0,0
IomF0pk3D,爱在2019的大龄剩女,6146815487,我才刚出院，姨甥女又因要住院了。2019年农历年底不好哟…求破解厄运 ,无,无,2020-01-07 12:08,荣耀10 AI变色更潮美,0,0,0
IomDQ1OEZ,秋风画冷屏x,6631617794,水平，国内无人能够在他的手撑过十分钟而不输的。 　　“针灸大师，甄一绝。南海御用针灸大师。”这个甄一绝，是三个人，名声最为响亮的。也是国内一致认定，可以稳稳的拿下胜利的一个。 　　毕竟棋艺这种东西，谁也  ,无,无,2020-01-07 12:06,微博 weibo.com,0,0,0
IomDEcSJM,陈义杰07,7366015573,【轻松筹】这个世界那么美好，儿子你一定要撑住！－个人救助  这孩子几次去南京军区医院治疗，不仅花光积蓄并且还借了不少钱！这次导致肺功能衰竭转入徐州医院治疗几日没多大效果，医院下了病危通知书！！！接着转入北京一家医院治疗现已好转但接下来的治疗费用对我们负债累累的家庭来说真是个头疼的问题！希望各位好心的朋友帮忙一下，帮帮我们家庭度过难关,无,无,2020-01-07 12:05,轻松筹App,0,0,1
IomD1u99F,哑口无言幻灵,7328028995,刘秀拔出刀，直接横在了章发脖颈上。然后迅速扭过头，冲着李通大声命令，“还不把老子的信物拿来？耽误了老子的事情，回头揭了你的皮  ,无,无,2020-01-07 12:04,微博 weibo.com,0,0,0
IomC4Ej7N,倾听者吖12138,6923734445,去年得了，差点死了，现在真的什么都想开了，对自己好点，珍惜啊 沈阳 ,无,#距离死亡最近的一次经历#,2020-01-07 12:01,华为手机 畅享玩不停,1,0,0
IomC1tl85,我是小张19,2758921385,分享凤凰新闻：新闻24小时|港特首：香港未现与武汉相关个案2020/01/07来自 ,无,无,2020-01-07 12:01,iPhone客户端,0,0,0
IomBKka3G,抗癌变奏曲,1003075913,抗癌进行曲：每天都有收获        收获痛苦，收获认知，收获关爱，收获轻松，每天都有新收获。经八院医生治疗，肝功能指标正常了，特别是帮我灭了克雷伯菌，原来一段时间尿频尿急及一夜夜起超10都是此菌在干坏事！现在夜起2次，无尿频尿急情况，多轻松啊！感恩八院医生对我进行专业水平的治疗。 ,无,无,2020-01-07 12:00,华为手机,0,0,1
IomBAeAUz,云备忘录,3233935234,我闺女怎么又开始偶尔咳嗽 和前段时间前期一模一样 我当时给她吃消炎药都没控制住 还是气管有炎症 然后又到肺部了 还在害怕当中 唉 我也不敢给他吃药 吃的药太多了 几乎天天净吃药了 ,无,无,2020-01-07 12:00,HUAWEI Mate 20 Pro,0,0,0
IomzjjJhH,因为爱你呀_,6883497404,假义的样子，霍尔顿很不痛快，两人吵了一场，分了手。接着霍尔顿独自去看了场电影，又到酒吧里和一个老同学一起喝酒，喝得酩酊大醉。他走进厕所，把头伸进盥洗盆里用冷水浸了一阵，才清醒过来。可是走出酒吧后，被冷风一吹，他的头发都结了冰。他想到自己也许会因此患死去，永远见不着妹妹菲苾了，决定冒险回家和她诀别。霍尔顿偷偷回到家里，幸好父母都出去玩了。他叫醒菲苾，向她诉说了自己的苦闷和理想。他对妹妹说，他将来要当一名“麦田里的守望者”：“有那么一群小孩子在一大块麦田里做游戏。几千几万个小孩子，附近没有一个人——没有一个大人，我是说——除了我。我呢，就在那混帐的悬崖边。我的职务是在那儿守望，要是有哪个孩子往悬崖边奔来，我就把他捉住——我是说孩子们都在狂奔，也不知道自己是在往哪儿跑。我得从什么地方出来，把他们捉住。我整天就干这样的事。我只想当个麦田里的守望者。”后来父母回来了，霍尔顿吓得躲进壁橱。等父母去卧室，他急忙溜出家门，到一个他尊敬的老师家中借宿。可是睡到半夜，他发觉这个老师有可能是个同性恋者，于是只好偷偷逃出来，到车站候车室过夜。霍尔顿不想再回家，也不想再念书了，决定去西部谋生，装做一个又聋又哑的人，但他想在临走前再见妹妹一面,无,无,2020-01-07 11:54,Android,0,0,0
IomydBq8l,果妈是个大肚婆,1862596125,我这一冬天真是忙啊 ，小的好了，大的流感病毒，大的好了换成小的流感，流感好了半个月小的又发烧。这是要把老娘累死啊 ,无,无,2020-01-07 11:52,iPhone客户端,0,0,0
Iomw3uaZ8,香港仁和体检HPV疫苗预约Angel,2310518780,十三價球菌結合疫苗 是預防之好方法！💉今天新聞公佈再多八人武漢返港後懷疑患肺炎😱衛生署也呼籲市民盡快🔜 接種疫苗💉 畢竟預苗是預防流感的最好的一個方法! 接種疫苗兩個星期後才會產生抗體!**肺炎球菌感染泛指由肺炎鏈球菌（或肺炎球菌）引致的疾病。雖然肺炎球菌一般只會引起鼻竇炎和中耳炎，但是它亦可引致嚴重的疾病及併發症，包括肺炎、腦膜炎和敗血病，能使聽覺及腦部受損甚至死亡。☠☠☠☠☠ **可以向我諮詢預約,无,无,2020-01-07 11:46,招代理iPhone 6s Plus(玫瑰金),0,0,0
IomvOpePo,知名小咖,5173757715,刘云峰 【宝宝感冒，小心5种并发症】 1、支气管：感冒后咳嗽加重，有罗音或痰鸣。2、鼻窦炎：细菌感染，多鼻塞、多脓涕、头痛。3、淋巴结炎：淋巴结迅速肿大，压痛。4、咽后壁脓肿：寒战高烧、头痛、恶心呕吐。5、理性化脓性中耳炎：宝宝由于咽鼓管较短平，易感染发脓。  ,无,无,2020-01-07 11:46,微博 weibo.com,0,0,0
Iomvo6pz6,晴儿yq58408,2537206187,图解疾病| 图解疾病| ,无,无,2020-01-07 11:45,学习强国客户端,0,0,0
IomvjqcHL,谭小容Luo-,7305965388,毁灭人只要一句话，培植一个人却要千句话，请你多口下留情。  ,无,无,2020-01-07 11:45,微博 weibo.com,0,0,0
IomvjqchT,中国医学论坛报,1641540265,武汉不明原因，5个你最关心的问题都在这里 ,无,无,2020-01-07 11:45,微博 weibo.com,8,7,1
IomuWl58H,京菁28821,7028721527,武汉发现不明原因病毒性59例 其中重症7例 ,无,无,2020-01-07 11:44,mcc_mi,0,0,0
Iomu8mQ0N,青岛检察,2620084095,通报！武汉不明原因排除SARS等病原因通报！武汉不明原因排除SARS等病原 ,无,无,2020-01-07 11:42,360安全浏览器,1,1,2
IomsSnDRg,思埠黛莱美岳阳经销商,5364279732,定一定，早在锦州城的时候，就不会主动往这大煞神眼前送！   第2章 失忆美人（二） 　　阿善与南安王世子的婚事，仅半日就传遍了皇城。 　　众人很难想象，平日里那位温润如玉宛如谪仙似的世子  ,无,无,2020-01-07 11:39,微博 weibo.com,0,0,0
IomsaDjvv,LUNAinHK,3345921372,春季返乡季，疫苗打起来 ,无,无,2020-01-07 11:37,iPhone客户端,2,1,0
IomrfCSro,肺诊网,6769181885,有关肺部疾病的十万个为什么！问：双肺多个微小结节，是否是肺炎或者其他？答：双肺微小结节通常不会有任何症状，咳嗽可能是由其他呼吸道疾病引起，需要完善胸部CT进一步明确诊断。建议听取胸外科医生的专业建议进行治疗。 ,无,无,2020-01-07 11:35,微博 weibo.com,0,0,0
Iomr7EVyo,零下248度的心脏,7273034555,cnm 大叶性你不考考你妈继发性肺结核呢 不要让我知道是谁的题 不然你妈必被我猎杀,无,无,2020-01-07 11:34,小米MIX 2 全面屏手机,0,0,0
IomqsgvvL,雨荷馨新,3179148814,不是咳出来的，咳嗽只是的伴随症状之一。武汉发现不明！这几类人群最易感染，别慌，教你正确防“感”措施 ,无,无,2020-01-07 11:33,荣耀V9 我想要的快,0,0,0
IompJ3aj8,新汉方TTS2005,7337361132,发布了头条文章：《卫健委通报：不明原因患者增至59例！已排除SARS！附相关问题解答》  卫健委通报：不明原因患者增至59例！已排除SARS！附相关问题解答 ,无,无,2020-01-07 11:31,微博 weibo.com,0,0,0
IompwmnDH,美和预约中心-国内香港HPV疫苗,5767030236,❗⚠防範高傳染性⚠❗近日香港醫院及衛生署接獲由外地到港疑肺炎通報，病者情況已趨穩定及退燒，你我仍需時刻加強注意個人衛生！注意個人衛生，呼籲大家做好一切預防傳染病的措施。為保障所有客戶健康，請各位做足以下措施：⚠口罩😷⚠勤洗手、以消毒搓手液消毒雙手🤲⚠做好個人衛生⚠注射正版正貨之肺炎防護疫苗💉❗如遇發熱、喉嚨痛、咳嗽等徵狀，請立即戴上口罩並盡早求醫。⚠接種 #十三價肺炎球菌結合疫苗 是預防肺炎之好方法！💉**肺炎球菌感染泛指由肺炎鏈球菌（或肺炎球菌）引致的疾病。雖然肺炎球菌一般只會引起鼻竇炎和中耳炎，但是它亦可引致嚴重的疾病及併發症，包括肺炎、腦膜炎和敗血病，能使聽覺及腦部受損甚至死亡。☠☠☠☠☠ **,无,无,2020-01-07 11:30,OPPO R9s Plus,0,0,0
IomouxkM1,徐州人民广播电台,2156564602,【，5个你最关心的问题都在这】为什么今年武汉市会发现“不明原因的病毒性”，怎样定义“不明原因的病毒性”？为什么病例数量会增加？如何防范？针对武汉不明原因病毒性情况，疾控专家、武汉市疾病预防控制中心主任李刚对群众关心的问题一一回应↓↓转发了解！,无,无,2020-01-07 11:28,专业版微博,2,1,0
IomopvMdY,2L84AD8,7316762580,我有个感觉，在大国，如果新闻上报道有什么事情，国民会感觉离自己很远。比如，有，我家乡的亲戚就会觉得离他们几千公里，很远，不会影响到自己。再比如，如果新闻说，群里乱说话的人，被判寻衅滋事。国民笑了，真傻，我就不会这样在群里讲，都是其他人的事。退一万步，即使自己得了肺炎，也会安慰自己说，你看，不是还有xx人得了肺炎吗。而大国之外的很多小国，或者小村恰恰相反。如果看到有，就赶快带上口罩，上次的教训结的疤还在，况且交通这么发达，说影响到自己就影响到自己。看到大国有人被判五花八门匪夷所思的罪名，就不停地犹豫，以后还是能不去就不去了。,无,无,2020-01-07 11:28,iPhone,8,2,6
IomnohCYZ,水母Horikitty,2749305057,『武汉发现不明原因 专家组已抵达武汉』武汉发现不明原因 专家组已抵达武汉 ,无,无,2020-01-07 11:25,iPhone,0,0,0
Iomm2nSBk,金针,1582948642,国家免疫规划酝酿调整：宫颈癌疫苗未入围 国家免疫规划酝酿调整：宫颈癌疫苗未入围 ,无,无,2020-01-07 11:22,分享按钮,0,0,0
IomkFfPs0,阿诺宝的QQ空间,6103142460,今天打疫苗,无,无,2020-01-07 11:18,HUAWEI Mate 30 Pro,2,0,0
IomjrAr9T,莫醒醒998887,6604206986,武汉市疾控中心主任：我市不明原因的病毒性防控工作正有序进行 武汉市疾控中心主任：我市不明原因的病毒性防控工作正有序进行 ,无,无,2020-01-07 11:15,Android,0,0,0
Iomj7dkoo,台宝儿科,6580296136,发布了头条文章：《冬季多发，小儿的症状及护理？这些都是你需要知道的...》  冬季多发，小儿的症状及护理？这些都是你需要知道的... ,无,无,2020-01-07 11:15,微博 weibo.com,1,0,0
Iomj1kpwC,同侃天涯18287,5320011237,武汉不明原因已排除SARS病原武汉市... 来自中国科普网 - 微博   ,无,无,2020-01-07 11:14,360安全浏览器,0,0,0
Iomg19ShG,映元仙道,5677078764,八字五行旺衰与身体健康：　　1、八字五行金太旺，容易呼吸不顺，感冒咳嗽，或有气喘等症状。　　2、八字五行缺金，则容易鼻子过敏、流鼻水、咳嗽、感冒、胸闷、腹泻或便秘，也导致鼻窦炎、气喘、肺炎、支气管炎、大肠息肉、直肠炎等问题。　　3、八字五行木太旺，容易肝胆出问题，容易肝火旺盛，要注意胆固醇，三酸甘油酯的问题。　　4、八字缺木，容易疲累，体力差。八字木有问题者，劝你要少喝酒，戒酒最好，要维持正常作息，早睡早起，才可以保护先天比较弱的肝胆功能。　　5、八字五行水太旺，体质比较寒冷，所以身体比较弱，容易手脚冰冷。　　6、八字五行缺水，则要注意泌尿系统的保健。这样做事虽快速有效率，但是欠缺缜密的思考，运气好的时后一帆风顺，运气差的时候白忙一场。　　7、八字五行缺火，容易有血压，贫血，心跳慢，容易疲累等心血管的机能问题。　　8、八字五行火太旺，容易有高血压，高血脂，心跳快等心血管机能较弱的问题。充满太多“火”的五行，也会导致健康，财运与事业的不圆满。　　9、八字五行土太旺，胃肠机能比较弱，容易有腹胀，腹痛，腹泻，消化吸收的问题。　　10、八字五行缺土，会有胃肠功能消化系统病变问题，例如食道炎，胃炎、胃溃疡、肠炎、大肠息肉、痔疮、糖尿病等问题。容易紧张、生活也比较缺乏规律性。不知道自己五行是旺衰可以咨询映元[抱拳],无,无,2020-01-07 11:07,OPPO Reno,1,0,0
IomeVbSBb,ainiyishengwuhui,2929169645,图解疾病| 图解疾病| ,无,无,2020-01-07 11:04,学习强国客户端,0,0,0
IomeT6Q1H,最IN珠海,1735965217, 【通知！近日澳门卫生局在各陆路口岸对入境人士进行体温筛查！因为...】就武汉市出现不明原因群集病例的情况，澳门卫生局对有关情况十分关注。为加强对各陆路口岸入境车道人员的卫生检疫措施，由4日凌晨起，澳门卫生局由治安警察局辅助人员协助对关闸、港珠澳大桥、跨工区和莲花等陆路口岸的入境车道司机、旅客进行体温筛查，澳门卫生局呼吁旅客配合有关工作。,无,无,2020-01-07 11:04,微博 weibo.com,2,1,0
Iomey8XeB,HAppy开心故事,6076007190,       【职业白领必看的13个魔鬼定律】还等什么，赶快收藏啦！ ,无,无,2020-01-07 11:03,微博 weibo.com,0,0,0
IomepgLQI,会姑娘的全世界,1311364201,住院第7天。早上去复查ct了，然后心情很愉悦的收拾东西准备出院。然后主任查房告诉我ct的结果是肺炎并没有好,无,无,2020-01-07 11:03,HUAWEI P30,1,0,3
Iomec0Kb5,八龙雷神,5847929662,发表了博文《临证秘典（原创）（107）（100年来的医学精典）》临证秘典（原创）（107）（100年来的医学精典）107、急性肺水肿（OedemaPulmonumAcutum）【原因】，肺痨，脚气临证秘典（原创）（107）（100年来的医学精典） ,无,无,2020-01-07 11:02,新浪博客,0,0,0
IombijFAK,用户7361454970,7361454970,武汉卫健委：共报告不明原因59例，排除SARS等病原 武汉卫健委：共报告不明原因59例，排除SARS等病原 ,无,无,2020-01-07 10:55,学习强国客户端,0,0,0
Iomadfykh,吴阿KING,1224873715,十一月份才出的院，一月份又进来了，还是熟悉的，还是熟悉的电梯。。 ,无,无,2020-01-07 10:53,iPhone客户端,0,0,0
Ioma47F6u,用户7257460610,7257460610,图解疾病| 图解疾病| ,无,无,2020-01-07 10:52,学习强国客户端,0,0,0
Ioma3cAvr,芝士甜甜三分甜,1866000244,刚刚打了13价 奶声奶气的哭了几声 可怜死啦 乖乖的平静渡过 ,无,无,2020-01-07 10:52,微博国际版,1,0,18
Iom9MkRvE,三实姐姐09516,2870328347,武汉通报不明情况：已排除SARS 武汉通报不明情况：已排除SARS ,无,无,2020-01-07 10:52,分享按钮,0,0,0
Iom9JEPDl,香港商報網,1847123567,【林郑月娥：香港目前无出现与武汉不明有关的个案 】 香港行政长官林郑月娥7日召开行政会议前见传媒，她表示，特区政府一向重视市民健康及安全，对湖北武汉市发生的情况高度关注，全力提高戒备，采取各项措施保障市民卫生安全。林郑月娥表示，香港目前没有出现与武汉不明有关的个案，但政府并不会因此而怠慢，会迅速应变、严阵以待、公开透明应对。,无,无,2020-01-07 10:51,微博 weibo.com,46,10,3
Iom9H3BUG,国人中医,1312622664,新年伊始，人民日报再次发文，发展中医药事业需要守正创新2020刚刚开局，国家再次强调加快推进发展中医药的重要性，这是为什么？因为人类（地球上的小虫虫）自己作害的自己活不下去了...例如：武汉近期不明原因的发高烧群体事件已经上升至59位，排出了病毒病菌感冒，排出了非典型肺炎，排出了发烧感冒，那么它是什么？是什么让这些人群发烧不退的∀？今天的医疗束手——没有答案。那么我来给答案：其实是天疫，是地对天大冲而形成的瘟疫，以后这样的事情会成为常态，直至群体坍塌……还有人畜共患的疾病，比如非洲猪瘟，猪流感、禽流感，我国北部的鼠疫，刚果正在爆发的埃博拉疫情已经造成2000多人死亡，正在世界各国上演尤其西方国家非常惊恐。癌症，肾衰竭，心脏病猝死在集中爆发的路途中……我曾说过：发展也好，经济也罢，必须要人民百姓先活下来才可以谈复兴，谈国泰民安，谈幸福快乐！,无,无,2020-01-07 10:51,微博 weibo.com,0,0,0
Iom9E7z9M,三实姐姐09516,2870328347,患者数量为何有所增加？武汉市疾控中心主任解答不明原因防控工作 患者数量为何有所增加？武汉市疾控中心主任解答不明原因防控工作 ,无,无,2020-01-07 10:51,分享按钮,0,0,0
Iom9oqs5T,奕茹贝贝,5729594272,一月七号，多米两岁四天，希望多米快点走路不要磕碰摔跤，呸呸呸我乱说话坏的不灵好的灵。希望她平安健康长大，开心快乐成长。菩萨保佑🙏多米感冒快点好，可以睡整夜安稳觉，不要有癫痫不会发作一切正常，我女儿身体健康一切正常。不要再生病。不咳嗽，没有不再鼻塞。不要再从鼻子里跑奶跑食物不呛咳，身体一切正常。保佑多米不要再发烧感冒，喉咙快好起来不要再吐奶，可以正常吃饭快快长肉。，希望多米的爷爷奶奶能好好的照顾多米。菩萨保佑🙏希望多米接下来每一天都这么乖，乖乖吃多饭饭乖乖睡整夜觉，我可以付出一切代价希望多米健康，菩萨保佑多米一切正常。一切不好的事情都让我来承受，保佑多米健康长大。肌张力低早起改善。不要再惊跳睡眠好睡整夜觉没有癫痫一切正常，希望我们一家人永远在一起。菩萨保佑，多米脑侧室增宽和囊肿快快消失。菩萨保佑🙏我们一家人永远健康平安在一起。菩萨保佑🙏多米不要再鼻塞咳嗽发烧，所有的话不会影响宝贝，菩萨保佑🙏菩萨保佑我女儿脑部智力发育一切正常，保佑我女儿不要再惊跳，菩萨保佑🙏希望宝宝喉管发育快好起来保佑我女儿智力听力检查顺利通过一切正常。我相信你一定是个健康的乖宝宝，🙏菩萨保佑🙏我女儿脑补血块快快自行吸收，囊肿不压迫血管神经自行吸收完全。菩萨保佑我女儿健康长大一切体检健康通过。保佑我女儿吃奶一切正常。菩萨保佑🙏我的女儿健健康康的长大。只希望你好，健康快乐的长大，菩萨保佑🙏我的多米一切健康顺利，额头上的红印快快消失，菩萨保佑🙏所有体检健康通过。只要宝贝健康麻麻一切都愿意。 保佑我的女儿健康快乐的长大。🙏,无,无,2020-01-07 10:51,iPhone客户端,0,0,0
Iom9mFlu0,武汉中阳中医医院,5443817967,【中阳助长健康】中阳助长膏方适用人群：1．生长发育迟缓，身高、智力增长速度慢于同年龄的小儿；2．脾胃虚弱，身体瘦弱，营养不良，厌食，容易积食的小儿；3．免疫力低下，容易感冒，易患过敏性咳嗽、过敏性鼻炎、支气管炎、，甚至哮喘、反复呼吸道感染的小儿；4．晚上睡眠不好，容易惊醒，辗转反侧难以入睡的小儿   ,无,无,2020-01-07 10:50,微博 weibo.com,0,1,0
Iom97ijFR,转角遇爱009,1789777105,我免费围观了  的回答，问题价值 20.00 元，快来一起围观~ <br />微博问答:感冒，雾化期间可以注射13价和流感疫苗吗? ,无,无,2020-01-07 10:50,微博 weibo.com,0,0,0
Iom8w4CLb,啊呀adrian,6559208632,是病好了。真相是因为寒邪入了里，所以没了表证，可是一旦将来再有外感风热或风寒，就会很容易复发，或者引发其他疾病。那么如果之前已经不明就里地挂了好多天的“水”，把压下去的朋友，该怎么办呢？还有救吗？李可老先生说，只要有阳气到达的地方，就不会生病，所以扶阳就好了。他具体推荐的是 ,无,无,2020-01-07 10:48,HUAWEI P30,1,0,0
Iom8nt9Ex,沉默是我最诚恳的诉说,5987683289,不明原因？？？🦠病毒迷惑行为？话说路上随地吐痰的人 是真真真tmd恶心人 ,无,无,2020-01-07 10:48,iPhone客户端,0,0,0
Iom7ioMVY,香港中通社,5999251130,【林鄭月娥：會與香港中聯辦主任駱惠寧緊密合作，令香港重回正軌,无,无,2020-01-07 10:45,微博 weibo.com,260,17,46
Iom69aClt,香港商報網,1847123567,【今日晨报】1.骆惠宁：会带着对香港的真诚和真情做好工作2.怀疑不明个案增至21人3.港12月PMI 42.1持续衰弱4.民建联88招献策预算案5.美众院拟限总统对伊军事行动6.中东局势影响暂退 美股逆转收高7.美宾夕法尼亚州事故多名华人受伤8.大火致澳洲牛羊袋鼠尸体堆积如山 9.武汉一工地发生坍塌事故6死5伤10.湖北：直接使用餐厨垃圾喂猪最高罚5万,无,无,2020-01-07 10:43,微博 weibo.com,19,8,4
Iom5V0c4Q,国庆妈本妈,5868483494,五点半起来q起来喝奶🍼，有点鼻塞，我妈说 害 不能打预防针了！要感冒了！于是心安理得地睡到九点半他再次醒😴发现我妈也是睡到九点半，几十年来第一次🤫今天qq顺利打上预防针了吗？没有。听说十三价威力很猛，动不动就发烧哭闹，还有过敏的，但还是要打😅等他状态好点再来吧，明天要去拍百日照咯，拖延症母亲是我了。可他脸上的蚊子包还没消，忧愁,无,无,2020-01-07 10:42,iPhone客户端,0,0,4
Iom5K6Bj7,李金霞LJX,2696015335,　　外加远低于秦家的价格。 　　“军方给刑男一个面子，但绝对的不会为他不惜一切的！”上面的推测，让花锦簇得出了这样的一  ,无,无,2020-01-07 10:42,微博 weibo.com,0,0,0
Iom5s2S1Q,泰康乐医院,6511228737,感冒和呼吸系统疾病。冬季气温变化莫测，温差较大或气温过低，空气干燥，是感冒多发季节。如果因着凉，导致免疫力下降，无力抵御，就会出现肺及呼吸道疾病，例如鼻塞、口干咽燥、咳嗽、发烧、咳痰及上呼吸道炎症、支气管炎、哮喘、等。特别是小儿、老年人、体弱及患有慢性呼吸系统病史患者更加容易再次发作。冬天比较冷，气管、血管不同水平上痉挛，供氧量就会减少，血流量缓慢，血压升高，从而心、脑血管疾病的发病率也会增高，因此大家要予以重视。特别是老年人应该注重保暖，防止血管收缩，血压升高，加重心脏负担和呼吸道传染。,无,无,2020-01-07 10:41,360安全浏览器,0,0,0
Iom5ofrAs,麼句王,1734970702,"我早二日开始咳，流鼻水，有痰，昨天还肚屙添；我问医生係咪""武汉""，医生话①病征是……咳，气速，发烧同肚屙《我只是中咗二样》②我又不在武汉；建议我照X光肺片先，我好大可能只係普通流感。 ",无,无,2020-01-07 10:41,三星A9s 颠覆性四摄,0,0,1
Iom522bmv,TT和麻麻的孤独星球,5513290998,13价钱交了，结果又让我去打五联，又跑下去交五联，所以今天顺利打上五联啦,无,无,2020-01-07 10:40,iPhone 7 Plus,1,0,2
