微博id,发布者,发布者id,微博正文,原始图片url,发布位置,发布时间,发布工具,点赞数,转发数,评论数
InOZvtzcD,用户5601785824,5601785824,我在看：【武汉华南海鲜市场休市 商户：并不担心被传染】  武汉华南海鲜市场休市 商户：并不担心被传染 ,无,无,2020-01-03 22:26,新浪新闻客户端,0,0,0
InOZhAnmc,CassyM,1227044891,甲流闹完了又来不明原因的肺炎呵呵提前放寒假喽,无,无,2020-01-03 22:25,iPhone客户端,0,0,2
InOYPvl0C,dl北北-clx,5640209941,🙏🙏大家都要平安健康 ,无,无,2020-01-03 22:24,邓伦的灯芯,1,0,0
InOYL6Q1F,脾气暴走的猪,2707461914,小宝生病了年内第三次因为支气管肺炎入院从29日晚到今天反复高烧五天昨日入院至今还没看到好转看着平日里机灵话多的小家伙现在却像霜打的茄子心里真的超级心疼 ,无,无,2020-01-03 22:24,荣耀20S,0,0,0
InOYsvT3H,今夜不无眠,6976337612,隔壁初中好多学生得全校停课了 我觉得我再咳下去也快了,无,无,2020-01-03 22:23,小米6 拍人更美,0,0,1
InOYkvJuz,财经新媒体,2660807713, 【武汉市卫健委关于不明原因的病毒性情况通报】未发现明显的人传人证据，病原鉴定和病因溯源工作正在进行中，已排除流感、禽流感、腺病毒感染等常见呼吸道疾病。 ,无,无,2020-01-03 22:23,HUAWEI P10,2,1,3
InOYfb0hL,狂酷拽的陆绎大人最帅气,6364824994,望安好！望早日攻克！！ ,无,无,2020-01-03 22:22,无,0,0,0
InOYejR1S,wayne余叔,6279013999,武汉市卫健委关于不明原因的病毒性情况通报截至2020年1月3日8时，共发现符合不明原因的病毒性肺炎诊断患者44例，其中重症11例，其余患者生命体征总体稳定。目前所有病例均在武汉市医疗机构接受隔离治疗，已经追踪到121名密切接触者并行医学观察，密切接触者的追踪工作仍在进行中。初步调查表明，未发现明显的人传人证据，未发现医务人员感染。病原鉴定(包括核酸检测和病毒分离培养)和病因溯源工作正在进行中，已排除流感、禽流感、腺病毒感染等常见呼吸道疾病。,无,无,2020-01-03 22:22,360安全浏览器,0,1,0
InOY8mfhp,哎呦喂---嘿,2151236504,老牛了，挂个急诊办住院的功夫，把陪床的干了,无,无,2020-01-03 22:22,OPPO超视野全面屏R15,0,0,0
InOY1gPDo,团子的新手妈妈,2876447574,5M31D  十三价第三针。六个月抽血检查和视力检测。没有贫血之类的。但是眼睛有散光，特别是左眼。禁止一切电子产品。 ,无,无,2020-01-03 22:22,iPhone客户端,0,0,2
InOXmuPkf,这是我的小仙女呀,2271863350,身体不适仍配合拍照的女鹅（年度捧场王👑）疫苗反应真真是厉害，每打一次就发烧一次，希望明天继续做一个活力四射的🐷 ,无,无,2020-01-03 22:20,iPhone客户端,2,0,0
InOXll9JT,Azure就是喃喃妈妈,6470489451,D53今天上午带喃喃去社区医院口服五价轮状疫苗，很顺利。宝贝也很乖，大概是没吃过甜的，喝完以后还砸吧嘴，哈哈。预约了下次打十三价肺炎的时间，那会儿已经在晋城了，希望晋城苗量充足，顺利打上。下午接着去市妇幼做理疗，乳晕上的脓肿汇集到一点了，正好碰到下午主任在，主任看了一眼说，还是抽一下脓吧，然后就很突然的进了手术间进行抽脓，打麻药的那一下依旧是最疼的，抽出一小管脓血后，大夫说干净了，现在就是左胸乳晕上的小硬块还在，需要再做两天理疗看预后恢复，希望周末做完理疗，周一复查就顺利结束啦！真的很感谢市妇幼乳腺门诊的开设，也很感谢群里的小姐妹推荐我去市妇幼做治疗。哺乳期乳腺炎在乳腺外科并不受重视，我跑到省人民医院乳腺科，人家都只是轻飘飘的说一句，就是乳腺炎啊，想办法排空吧。这是全省最好的乳腺外科，但是他们对哺乳期乳腺炎根本不重视，仿佛哺乳期乳腺炎是再寻常不过的事情了，然后得了哺乳期乳腺炎大多数的宝妈只能选择所谓的催乳师解决病痛，而使乳房饱受伤害。市妇幼的技术还是很棒的，可以理疗轻症，脓肿也不论大小都给进行超声穿刺，在医院可以解决乳腺炎问题让人感觉安心不少。感恩！ ,无,http://t.cn/RJ2BoPz,2020-01-03 22:20,iPhone客户端,1,0,4
InOWPpYSw,你的好友已经打卡,1223440550,发生了什么？,无,无,2020-01-03 22:19,荣耀10青春版,0,0,0
InOWOvtmP,唐英说爱,2428737604,《【武汉市卫健委：发现不明原因病毒性44例，其中重症11例】1月3日，武汉市卫健委发布关于》环球网在百度动态发表了新动态，快来和ta互动吧 ,无,无,2020-01-03 22:19,百度App,0,0,0
InOWNDfwb,泡芙小圆子·,6593995380,天哪 医护人员也要注意安全 大家都平平安安 ,无,无,2020-01-03 22:19,王源的小汤圆,4,0,0
InOWJuoFq,用户6161568443,6161568443,我在看：【关于武汉疫情 武汉市委机关报回答6个问题】  关于武汉疫情 武汉市委机关报回答6个问题 ,无,无,2020-01-03 22:19,新浪新闻客户端,0,0,0
InOWA6jks,罗俊今日证券,2132172230,截至2020年1月3日8时，武汉共发现符合不明原因的病毒性诊断患者44例，其中重症11例！ ,无,无,2020-01-03 22:18,360安全浏览器,16,0,0
InOWu9L5f,用户6161568443,6161568443,我在看：【武汉共发现44例病毒性患者 其中重症11例】  武汉共发现44例病毒性患者 其中重症11例 ,无,无,2020-01-03 22:18,新浪新闻客户端,0,0,0
InOWecJHA,铁血观察,5173525563,"发布了头条文章：《武汉传入香港？流言四起, 人心惶惶!》  武汉传入香港？流言四起, 人心惶惶! ",无,无,2020-01-03 22:17,原创首发超话,26,6,6
InOW00tHH,青春是道明媚的伤痕--smile,1773635964,61天的弟弟 又是要住院了 ,无,无,2020-01-03 22:17,iPhone客户端,1,0,0
InOVSjpwf,贵州交通广播,2037509875,【武汉卫健委：】3日，：2019年12月以来，我委开展呼吸道疾病及相关疾病监测，发现不明原因的病毒性病例，病例临床表现主要为发热，少数病人呼吸困难，胸片呈双肺浸润性病灶。截至2020年1月3日8时，共发现符合不明原因的病毒性诊断患者44例，其中重症11例，其余患者生命体征总体稳定。目前所有病例均在武汉市医疗机构接受隔离治疗，已经追踪到121名密切接触者并行医学观察，密切接触者的追踪工作仍在进行中。流行病学调查显示，部分病例为武汉市华南海鲜城经营户。截至目前，初步调查表明，未发现明显的人传人证据，未发现医务人员感染。病原鉴定（包括核酸检测和病毒分离培养）和病因溯源工作正在进行中，已排除流感、禽流感、腺病毒感染等常见呼吸道疾病。疫情发生后，国家和省卫生健康委高度重视，派出工作组和专家组赴武汉市，指导当地开展疫情应对和处置工作。武汉市卫生健康委在全市医疗机构开展相关病例搜索和回顾性调查，已完成对华南海鲜城的环境卫生处置工作，进一步的卫生学调查正在进行中。,无,无,2020-01-03 22:17,iPhone客户端,2,0,2
InOVMpTpH,给头n黑程物_w,7361891332,外出佩戴口罩密闭空间少呆 像防流感一样防不明原因外出佩戴口罩密闭空间少呆 像防流感一样防不明原因 ,无,无,2020-01-03 22:16,iPhone客户端,0,0,0
InOVJ9Gqn,今天会发糖嘛,5515114358,希望春节放假前能出来确切的一个结果，我想回家,无,无,2020-01-03 22:16,iPhone客户端,3,0,2
InOVkl26R,hzghm,1686013772,11÷44=0.25，0.25×100%=25% ,无,无,2020-01-03 22:15,Android,0,0,0
InOVizlWV,秀美的小欧,3797687603, 【育儿】家住武昌，孩子咳嗽呼吸急，担心是小儿流行性喘憋性【育儿】家住武昌，孩子咳嗽呼吸急，担心是小儿流行性喘憋性 ,无,无,2020-01-03 22:15,手机新浪网,1,0,0
InOVdgMnJ,矣言,2932971252,武汉卫健委通报：发现不明原因病毒性患者44例 武汉市卫健委通报不明原因的病毒性情况 ,无,无,2020-01-03 22:15,分享按钮,0,0,0
InOV5xTHf,yushui55,1416713854,武汉不明原因升至44宗武汉卫生健康委员会公布截至今日(3日)上午8时，共发现符合不明原因的病毒性肺炎诊断患者44例，其中重症11例，其余患者生命体徵总体稳定。目前所有病例均在武汉市医疗机构接受隔离治疗，已经追踪到121名密切接触者并行医学观察，密切接触者的追踪工作仍在进行中。武汉卫健委於去年12月31日公布录不明原因病毒性肺炎诊断患者27例。武汉卫健委指，流行病学调查显示，部分病例为武汉市华南海鲜城经营户。目前初步调查表明，未发现明显的人传人证据，未发现医务人员感染。病原监定和病因溯源工作正在进行中，已排除流感、禽流感、腺病毒感染等常见呼吸道疾病。(ek/a),无,无,2020-01-03 22:15,搜狗高速浏览器,0,0,0
InOUZ38Tu,wisdomsea,1469679623,记者太不专业了…………什么叫做不是典型？汉语   不是，那就是非。哇塞！ ,无,无,2020-01-03 22:14,全屏双摄 OPPO A5,0,0,0
InOUXzJRU,旺组每日幸福播报,6383586875,大家都要注意安全呀！ ,无,无,2020-01-03 22:14,无,1,0,3
InOUW92x9,木子小小婧-,2536292030,外出佩戴口罩密闭空间少呆 像防流感一样防不明原因 - 健康 - 新京报网外出佩戴口罩密闭空间少呆 像防流感一样防不明原因 ,无,无,2020-01-03 22:14,iPhone客户端,0,0,0
InOU6n0YQ,我才是宇宙第一大可爱,1724818951,回宿舍说我去ICU有个MARS感染的病人嘉佩说她最近看肺炎病人然后我们看综艺看得我不想洗澡了嘉佩：你也不咋干净哈哈哈哈哈哈哈哈哈哈哈哈哈哈 南京·中国药科大学江宁校区 ,无,无,2020-01-03 22:12,☁️iPhone,0,0,0
InOTJkbYL,钢七连Unbreakable7,7304955612, 【林郑在高铁西九龙站视察口岸防控措施 对前线清洁人员表示感谢】香港特区行政长官林郑今日到香港高铁西九龙站，视察本港就湖北省武汉市出现的病例群组个案，在出入境口岸所采取的预防措施。林郑在食物及卫生局局长陈肇始教授陪同下，在出入境口岸听取卫生署卫生防护中心港口卫生科人员讲解健康监察措施，包括提供健康资讯、以红外线热像仪对入境人士进行体温监测，以及跟进发烧的旅客。林郑与前线人员交谈，了解他们执行防控措施的情况，亦感谢他们为保障市民和旅客的健康辛勤工作。 ,无,无,2020-01-03 22:11,祖国反黑站超话,111,0,17
InOTHyxtO,吉子30164,5852250802,最新通报！武汉发现44例不明原因病毒性诊断患者最新通报！武汉发现44例不明原因病毒性诊断患者 ,无,无,2020-01-03 22:11,iPhone客户端,1,0,0
InOTD89at,券商中国,5883677894,【财闻联播】全球最大公募将取消股票交易佣金！武汉：不明原因的病毒性已排除流感【财闻联播】全球最大公募将取消股票交易佣金！武汉：不明原因的病毒性已排除流感 ,无,无,2020-01-03 22:11,HUAWEI P30,1,1,0
InOTomqsj,哆宝和廷廷的王能麻麻,6580557145, 前几天一直嗓子不舒服，还怀疑是吃了海鲜的原因 ,无,无,2020-01-03 22:10,iPhone XS Max,0,0,2
InOTatbK6,尤春雷息壤,5820270743,热度一点点下去，38万，37万，36万，大家注意防护，总没有坏处,无,无,2020-01-03 22:10,Redmi Note 8 Pro四摄,0,0,0
InOT4yLFw,苏苏苏苏乆,6623564634, 希望武汉这次不要太严重，都要平安度过啊。也希望期末能考好一点吧。 ,无,无,2020-01-03 22:10,OPPO智能手机,4,0,0
InOSWzWo2,青压z养事而_,7361582563,外出佩戴口罩密闭空间少呆 像防流感一样防不明原因外出佩戴口罩密闭空间少呆 像防流感一样防不明原因 ,无,无,2020-01-03 22:09,iPhone客户端,0,0,0
InOSRxecW,Rrrosie23,1919286897,住在附近的人，瑟瑟发抖。每天电梯都是消毒水的味道 ,无,无,2020-01-03 22:09,iPhone客户端,12,3,4
InOSRj8O1,欢喜春秋5555,7222816798,武汉市卫健委关于不明原因的病毒性情况通报_调查  ,无,无,2020-01-03 22:09,分享按钮,0,0,0
InOSNrbi8,薄荷味的樟脑丸,3966829150,『外出佩戴口罩密闭空间少呆 像防流感一样防不明原因 - 健康 - 新京报网』外出佩戴口罩密闭空间少呆 像防流感一样防不明原因 ,无,无,2020-01-03 22:09,OPPO随光而变R17,0,1,0
InOSEfNZw,玫瑰香狐,5871047286,外出佩戴口罩密闭空间少呆 像防流感一样防不明原因外出佩戴口罩密闭空间少呆 像防流感一样防不明原因 ,无,无,2020-01-03 22:09,微博 weibo.com,0,1,0
InOSBBlwq,香港商報網,1847123567,【林郑在高铁西九龙站视察口岸防控措施 对前线清洁人员表示感谢】香港特区行政长官林郑今日到香港高铁西九龙站，视察本港就湖北省武汉市出现的病例群组个案，在出入境口岸所采取的预防措施。林郑在食物及卫生局局长陈肇始教授陪同下，在出入境口岸听取卫生署卫生防护中心港口卫生科人员讲解健康监察措施，包括提供健康资讯、以红外线热像仪对入境人士进行体温监测，以及跟进发烧的旅客。林郑与前线人员交谈，了解他们执行防控措施的情况，亦感谢他们为保障市民和旅客的健康辛勤工作。,无,无,2020-01-03 22:09,微博 weibo.com,127,8,18
InOSBjG7h,D熊猫不是猫,1907179553,不管情况如何，还是要戴口罩出门，先把自己保护好，希望专家们在春节前把这个搞清楚,无,#武汉卫健委通报不明原因肺炎#,2020-01-03 22:09,HUAWEI Mate 30 5G,0,0,0
InOSme0yQ,倔强的两个人的孤单,5703773593,"外出佩戴口罩密闭空间少呆 像防流感一样防不明原因2020-01-03 19:16:43新京报 记者：王卡拉近日，武汉华南市场发生的不明原因事件，将“不明原因”的概念带入公众视野。1月3日，武汉市卫生健康委发布最新进展，截至2020年1月3日8时，共发现符合不明原因的病毒性诊断患者44例，其中重症11例，其余患者生命体征总体稳定。已经追踪到121名密切接触者，并进行医学观察，密切接触者的追踪工作仍在进行中。 引起不明原因的因素各有不同，在全国也时有发生，我国目前已建立了成熟的监测体系。但对于公众而言，了解不明原因，并掌握一些防范技巧最为关键。 何为不明原因？ “不明原因”是继SARS流行之后，原卫生部为了更好地及时发现和处理SARS、人禽流感以及其他表现类似、具有一定传染性的而提出的一个名词。从严格意义上来说,“不明原因”不是一个严谨的医学概念,但作为筛选SARS、人禽流感等具有一定特殊临床表现和一定传染性的一类仍有一定意义。这对及时发现可疑病例,早期发出预警并采取相应的防控措施,及早防范很有意义。 海淀医院感染性疾病科主任医师董建平指出，并不是每种都能查到致病原因，这受限于目前的技术或是初步使用的检测技术。从医院角度来看，如果发现病情进展比较迅速，病情较重的不明原因，为了防止病情扩散，避免出现此前SARS时的情况，一定会及时上报。 不明原因对社会生产和群众生活均带来极大危害，一般病情比较重，常常发生急性呼吸窘迫综合征，因此病死率一般比较高。SARS的病死率一般在10%左右,而人禽流感的病死率在60%以上。当然,不明原因除SARS和禽流感外,也可能会包括其他的一些病原引起的,例如军团菌、其他病毒引起的等，它们均是以为主要临床表现的急性呼吸道传染病。 做好不明原因病例监测、排查和管理工作，及时发现疫情、迅速采取有效措施是控制疫情的关键环节。为筛查SARS和人禽流感病例以及其他聚集性发生的呼吸道传染病，及时发现疫情并采取相应的防控措施有效控制疫情，防止疫情扩散，早在2007年，原卫生部就组织有关专家，在《全国不明原因病例监测实施方案》的基础上，研究制定了《全国不明原因病例监测、排查和管理方案》。 同时具备以下4点则为不明原因 不明原因病例是指同时具备以下4条不能做出明确诊断的病例：1、发热(≥38℃)；2、具有或急性呼吸窘迫综合征的影像学特征；3、发病早期白细胞总数降低或正常,或淋巴细胞分类计数减少；4、经规范抗菌药物治疗3-5天,病情无明显改善或呈进行性加重。 根据具体的流行病学特点和患者的高危因素又可以分为SARS预警病例和人禽流感预警病例。两周内发生的有流行病学相关性的2例或2例以上的不明原因病例就成为聚集性不明原因病例。有流行病学相关性，即病例发病前曾共同居住、生活、工作、暴露于同一环境，或有过密切接触，或疾控专业人员认为有流行病学相关性的其他情况。 专家：不明原因可控可治 不必恐慌 此次武汉发生的不明原因，专家从病情、治疗转归、流行病学调查、实验室初步检测等方面情况分析认为，病例系病毒性。目前对病原的检测及感染原因的调查正在进行中。武汉市卫生健康委指出，病毒性多见于冬春季，可散发或暴发流行，临床主要表现为发热、浑身酸痛、少部分有呼吸困难，肺部浸润影。 病毒性与病毒的毒力、感染途径以及宿主的年龄、免疫状态有关。引起病毒性的病毒以流行性感冒病毒为常见，其他为副流感病毒、巨细胞病毒、腺病毒、鼻病毒、冠状病毒等。确诊则有赖于病原学检查，包括病毒分离、血清学检查以及病毒抗原及核酸检测。 “病毒性在冬天比较多见，且可控可治，市民完全没有必要恐慌。”董建平指出，一般病毒感染为上呼吸道感染，很多人一周左右可以自愈，如果出现发烧症状要注意休息与隔离，密切观察。但也不排除发生重症的情况，如果出现呼吸道感染症状后体温高烧不退，咳嗽伴有胸痛、咳血痰等症状，一定要引起重视，及时就诊。 在防控措施上，董建平表示，预防不明原因与防控流感的措施类似，保持室内空气流通，每天保证半小时的开窗通风，但要注意保暖，避免着凉引起呼吸道防护技能下降。避免到封闭、空气不流通的公众场合和人多集中地方，外出可佩戴口罩。预防接种链球菌疫苗和(或)流感疫苗可减少某些特定人群罹患的机会。 不明原因往往对于老人、儿童、慢性基础病人群、肿瘤患者、免疫疾病患者、使用免疫抑制剂的人群打击往往很大，这几类人群需要在出现症状时第一时间关注和就诊。一般而言，青壮年可以居家隔离，不需要住院和治疗。但也有个别会出现重症病例，比如感染病毒后出现超敏反应的情况，应注意观察。 另外，《全国不明原因病例监测、排查和管理方案》中提及，戒烟、避免酗酒也有助于预防的发生。 新京报记者 王卡拉编辑 王鹿 校对 柳宝庆41",无,无,2020-01-03 22:08,荣耀20i,0,0,0
InOS83g1Z,姐姐储存很足,5874542583,明天要体检，因为那个什么，还要打针，抽血？？体检完，72小时不能洗澡？？？三天？？？我怕不是要臭了我脑仁疼！ ,无,无,2020-01-03 22:07,甜汀牌Android,4,0,10
InORWwfS2,我们_好久好久不贱鸟,3608504314,『外出佩戴口罩密闭空间少呆 像防流感一样防不明原因 - 健康 - 新京报网』外出佩戴口罩密闭空间少呆 像防流感一样防不明原因 ,无,无,2020-01-03 22:07,OPPO随光而变R17,0,0,0
InORJh3lg,浪沫湾,3077189012,8名散布武汉谣言者被依法查处！近期，武汉市部分医疗机构发现接诊了多例病例，武汉市卫健委就此发布了情况通报。但一些网民在不经核实的情况下，在网络上发布、转发不实信息，造成不良社会影响。公安机关经调查核实，已传唤8名违法人员，并依法进行了处理。警方提示，网络不是法外之地，在网上发布信息、言论应遵守法律法规，对于编造、传播、散布谣言，扰乱社会秩序的违法行为，警方将依法查处，绝不姑息。希望广大网民遵守相关法律法规，不造谣、不信谣、不传谣，共建和谐清朗的网络空间。,无,无,2020-01-03 22:06,央视新闻,10,0,6
InOR4aoFo,荆门网警巡查执法,5922614510,外出佩戴口罩密闭空间少呆 像防流感一样防不明原因 外出佩戴口罩密闭空间少呆 像防流感一样防不明原因 ,无,无,2020-01-03 22:05,360安全浏览器,1,0,0
InOPNgWoJ,用户talcbm60os,3687423257,武汉卫健委通报：发现不明原因病毒性患者44例 武汉市卫健委通报不明原因的病毒性情况 ,无,无,2020-01-03 22:02,分享按钮,0,0,0
InOPLczw7,山西阳泉市反邪教,5273977524,【武汉发现不明原因病毒性诊断患者44例】据武汉市卫健委3日最新通报，截至当日8时，共发现符合不明原因病毒性诊断患者44例，其中重症11例。　　通报说，目前所有病例均在武汉市医疗机构接受隔离治疗，除11名重症外，患者生命体征总体稳定。　　流行病学调查显示，部分病例为武汉市华南海鲜城经营户。病原鉴定（包括核酸检测和病毒分离培养）和病因溯源工作正在进行中，已排除流感、禽流感、腺病毒感染等常见呼吸道疾病。截至目前，初步调查表明，未发现明显人传人证据，未发现医务人员感染。　　目前，已追踪到121名密切接触者并进行医学观察，密切接触者的追踪工作仍在进行中。武汉市卫健委在全市医疗机构开展相关病例搜索和回顾性调查，已完成对华南海鲜城的环境卫生处置工作，进一步的卫生学调查正在进行中。　　2019年12月以来，武汉市卫健委开展呼吸道疾病及相关疾病监测，发现不明原因的病毒性病例，病例临床表现主要为发热，少数病人呼吸困难，胸片呈双肺浸润性病灶。　　疫情发生后，国家和湖北省卫生健康委高度重视，派出工作组和专家组赴武汉市，指导当地开展疫情应对和处置工作。（记者廖君、黎昌政）,无,无,2020-01-03 22:02,nova4自拍极点全面屏,1,2,0
InOPAyNbo,火速头条,5939969094,【】据武汉市卫健委3日最新通报，截至当日8时，共发现符合不明原因病毒性诊断患者44例，其中重症11例。 　　通报说，目前所有病例均在武汉市医疗机构接受隔离治疗，除11名重症外，患者生命体征总体稳定。 　　流行病学调查显示，部分病例为武汉市华南海鲜城经营户。病原鉴定（包括核酸检测和病毒分离培养）和病因溯源工作正在进行中，已排除流感、禽流感、腺病毒感染等常见呼吸道疾病。截至目前，初步调查表明，未发现明显人传人证据，未发现医务人员感染。（新华视点）,无,无,2020-01-03 22:01,微博 weibo.com,3,0,2
InOPxiebI,街角的眼眸湿润了谁的梦,5973350353,武汉卫健委最新通报：共发现44例病毒性患者 武汉卫健委最新通报：共发现44例病毒性患者 ,无,无,2020-01-03 22:01,分享按钮,0,0,0
InOPtvUZd,追梦人5678,5083862993,外出佩戴口罩密闭空间少呆 像防流感一样防不明原因外出佩戴口罩密闭空间少呆 像防流感一样防不明原因 ,无,无,2020-01-03 22:01,微博 weibo.com,0,3,0
InOP3bjAN,佛自在世界,1284665024,刚刚，武汉市卫健委通报了关于不明原因的病毒性的最新情况：已发现44例患者，其中重症11例，其余患者生命体征总体稳定。此外，已经追踪到121名密切接触者并行医学观察，密切接触者的追踪工作仍在进行中。  武汉共发现44例病毒性患者 其中重症11例 ,无,无,2020-01-03 22:00,新浪新闻客户端,1,0,0
InOP1EUlk,鼠girl,2594136977,"前两天散布关于武汉不明原因的谣言者，已经被公安机关依法处理。被新浪封号的王治安在Twitter上，说的有鼻子有眼儿的什么""流行病学专家讲，高度疑似..."" ",无,无,2020-01-03 22:00,HUAWEI Mate30 Pro 5G,3,2,3
InOOH1Qx7,居居的小扇子,6720899539,不会传染就好 ,无,无,2020-01-03 21:59,朱一龙的小笼包,1,0,0
InOOeCYCq,仪的的的,5240336382,可不要封城哦 我马上就回家了,无,无,2020-01-03 21:58,HUAWEI P30 Pro,0,0,0
InOO9mlxY,国金证券-佣金宝,3993309948,【武汉市卫健委：】武汉卫健委发布公告，截至目前，初步调查表明，，未发现医务人员感染。病原鉴定（包括核酸检测和病毒分离培养）和病因溯源工作正在进行中，已排除流感、禽流感、腺病毒感染等常见呼吸道疾病。 ,无,无,2020-01-03 21:58,微博 weibo.com,0,0,0
