微博id,发布者,发布者id,微博正文,原始图片url,发布位置,发布时间,发布工具,点赞数,转发数,评论数
IraXZnVHM,木木木小霖,5525486382, ,无,无,2020-01-25 23:53,小米8周年旗舰手机,0,0,0
IraXZmbDi,用户7341912489,7341912489,,无,无,2020-01-25 23:53,HUAWEI Mate 30 5G,0,0,0
IraXZ6S7j,芜湖反邪教,6314335664,【只要有爱，每天都是好日子！为应对疫情，,无,无,2020-01-25 23:53,iPhone客户端,2,0,0
IraXYrTLH,bomi0,5063932820,深夜排查武汉 ,无,无,2020-01-25 23:53,iPhone客户端,0,0,0
IraXXCUvj,亳州涡阳公安在线,5334418315,【紧急通知！全市一切群体性集会活动取消】亳州市新型冠状病毒感染的疫情防控应急指挥部通告（第一号） ,无,无,2020-01-25 23:53,微博 weibo.com,15,1,11
IraXXAwgY,胡楠瓜,5510298886,徐州泉山区的至少公布了具体地址，确定了范围，沛县的连个范围都没有！！！   徐州·沛县 ,无,#徐州肺炎#,2020-01-25 23:53,iPhone客户端,61,0,21
IraXXjAaK,弯来西安内,1403645965,据福建日报：根据《福建省突发公共卫生事件应急预案》，经研究，福建省启动重大突发公共卫生事件一级响应，各级各部门要严格按照国家关于新型冠状病毒感染的“乙类传染病，采取甲类管理”的要求，制定周密方案，层层压实责任，确保最严格的科学防控措施落实到位，全力维护人民群众健康安全。,无,无,2020-01-25 23:53,同安超话,0,0,0
IraXXjzzC,李阳华-2019,5238289888,西藏自治区新型冠状病毒感染的医疗救治定点医院和发热门诊名单公布 西藏自治区新型冠状病毒感染的医疗救治定点医院和发热门诊名单公布 ,无,无,2020-01-25 23:53,学习强国客户端,0,0,0
IraXX3ytA,龟兔孰赢,1934733073,【紧急扩散！21日22点山航航班SC8734的旅客请尽快联系疾控部门】青岛市城阳区新型冠状病毒感染防控指挥部1月25日发布紧急通知，2020年1月25日，城阳区确诊一例新型冠状病毒感染患者。该患者于1月21日上午与其丈夫一起坐火车从湖北钟祥到汉口， 随后从火车站打车18点左右到达武汉天河机场，乘坐21日22点00分山航航班SC8734（坐位号10E），于22日凌晨零时左右到达青岛流亭国际机场。乘坐该航班（山航SC8734）的乘客朋友，鉴于您与确诊的新型冠状病毒感染的患者乘坐了同趟航班，有感染的风险，为了您和他人的身体健康，请您主动与城阳区疾病预防控制中心（联系电话：87868062）或您所在地的疾控部门联系，配合做好医学观察，若有发热、咳嗽等症状，请及时到就近的定点医院发热门诊就诊（城阳区定点发热门诊信息附后），以便进一步诊治。为确保您和他人的身体健康，在就医途中请您戴上口罩，尽量不要乘坐公共交通工具前往医院。若需居家进行医学观察的，请不要外出，佩戴口罩，与家人共同做好个人防护，以保障您和家人的健康。,无,无,2020-01-25 23:53,华为Mate10保时捷设计,2,1,0
IraXWrROb,用户7243405762,7243405762,今日（25日）上午，湖南新增确诊病例19例。截至 1 月 24 日 24 时，湖南省累计报告新型冠状病毒感染的确诊病例 43 例，重症病例 15 例，死亡病例 0 例，出院病例 0 例。大年初一上午，省委书记杜家毫，省委副书记、省长许达哲分别来到中南大学湘雅二医院、长沙市第一医院，看望慰问医务人员，督导检查新型冠状病毒感染的疫情防控工作。随后，许达哲还前往省通信管理局，了解大数据支撑疫情联... ,无,无,2020-01-25 23:53,vivo智能手机,0,0,0
IraXWadTD,法国囧事,2981906842,果然只有女人和矮子才能救法国........😂 ,无,无,2020-01-25 23:53,iPhone X,62,26,10
IraXWabCX,欧MY鱼儿,7376706178,原谅我的无知,无,无,2020-01-25 23:53,Android客户端,0,0,0
IraXVw9Jf,耐斯部落,7318702858,这几天家里蹲着实让本酋长烦闷的紧，于是乎刚刚外出采购了整箱啤酒，顺便买了这个，不知道算不算野味呢,无,无,2020-01-25 23:53,Android客户端,1,0,0
IraXUF7YM,借水_买醉,6005938069,"我提出了问题""根据现在这个新型冠状病毒感染疫情，会不会延长开学时间?""根据现在这个新型冠状病毒感染疫情，会不会延长开学时间?  ",无,无,2020-01-25 23:53,小米8周年旗舰手机,0,0,0
IraXUF7PR,卑微一枝花,5124418503,我在看：【钟南山：新型冠状病毒很可能来自野味】  钟南山：新型冠状病毒很可能来自野味 ,无,无,2020-01-25 23:53,新浪新闻客户端,0,0,0
IraXUCOqZ,川广新闻,3491895860,【四川大学华西医院接受社会捐赠公告】为更好地保障新型冠状病毒感染的疫情防治需要，保护一线医务人员，华西医院将开通接受捐赠渠道， 接受依法合规捐赠的正规渠道、资质齐全的下列防护物资：防护服、隔离衣、防冲击眼罩、防护面罩、N95口罩。 四川大学华西医院接受社会捐赠公告 ,无,无,2020-01-25 23:53,微博 weibo.com,1,0,0
IraXUBUPv,易大佬好腰好胯好胸肌,2010073795,不要跟我吹牛逼当年经历过非典，现在的算个屁，让你提高点警惕你说我们闲着没事传播恐慌,无,无,2020-01-25 23:53,XXXXiPhone 7 Plus,3,0,0
IraXU5N79,荷叶先生,3833657572, 实时数据 | 新型冠状病毒最新数据：确诊1430例 死亡42例实时更新：新型疫情最新动态 来自 ,无,无,2020-01-25 23:53,腾讯新闻客户端,0,0,0
IraXTu7hh,奥特曼的大灯泡,1766551302,『全国新型疫情实时动态 - 丁香园·丁香医生』 ,无,无,2020-01-25 23:53,iPhone客户端,0,0,0
IraXSA8LG,福山发布,3214972460, ,无,无,2020-01-25 23:53,微博 weibo.com,0,2,1
IraXSyoUz,鬼鬼请求和theshy对线,6227301879,每天在家憋的胸闷气短，看一下扩散的疫情，就要配合刷一下解放军叔叔和各地救援物资医疗人员来汉的新闻才能缓解症状 武汉 ,无,#肺炎症状#,2020-01-25 23:53,iPhone客户端,32,1,7
IraXSiuID,抚州南丰发布,2729232002,辟谣！！！关于近日南丰县各类微信群、朋友圈谣传“南丰县新型冠状病毒感染的防控指挥部令第1号”的文件为虚假信息，请广大市民不信谣、不传谣。一切官方信息以：“南丰县人民政府”官网、“南丰发布”微信公众号、“桔都南丰”App、“抚州南丰发布”官方微博为准。 ,无,无,2020-01-25 23:53,iPhone 7,1,2,4
IraXSgLod,再见二丁目yyyyy,5737764084,医护人员好辛苦     导致医院都弥漫一股紧张的味道希望家人身体健康   一直平安   好人一生平安  🙏 ,无,无,2020-01-25 23:53,nova5i 2400万AI四摄,0,0,0
IraXRpJs1,一眼万年丨王一博,3599293825,终于，往好的方向发展了🙏🙏 ,无,无,2020-01-25 23:53,耶啵的iPhone XS,0,0,0
IraXRmwNf,粗溜粗溜儿的粗溜_,5937952474,希望我爱的小城快快好起来吧,无,无,2020-01-25 23:53,小粗溜儿的Android,16,0,0
IraXRmuQE,镇宁宣传,3956606514,25日疫情最新防控举措，戳图⬇ ,无,无,2020-01-25 23:53,HUAWEI P30 Pro,0,0,0
IraXR98KD,媒媒媒媒,5977845978, 新一年愿望只有一个了: 疫情解除 世界无疾病 大家都平安,无,无,2020-01-25 23:53,iPhone 7 Plus,3,0,0
IraXR4S3L,用户6241925016,6241925016,北京加强新型防控 从疫情发生地区回京人员居家观察14日 北京加强新型防控 从疫情发生地区回京人员居家观察14日 ,无,无,2020-01-25 23:53,学习强国客户端,0,0,0
IraXQvKmb,快人快语的说客,1549637620,我国确诊1372例新型冠状病毒病例 我国确诊1372例新型冠状病毒病例 死亡41例  ,无,无,2020-01-25 23:53,北京日报APP,0,0,0
IraXQvIjE,司徒离曜,5800000481, 何必要理会一些喷子蹭热搜的言论，疫情就是给它们提供借口而已，有人看见明星就喷，有人双标自己喜欢的明星上榜就不喷只喷别人，咱们做好预防工作安全待在家里看春晚表演就行了，三观不正的人自有天收报应在路上呢，可能染不上但脑子已经残了,无,无,2020-01-25 23:53,郑爽超话,1453,39,116
IraXQtbeu,沈阳新闻广播,5816684132,预防新型冠状病毒健康科普系列文章之在公共场所如何预防新型冠状病毒？面对预防新型冠状病毒，要尽量少到人群密集的场所。当我们不可避免到公共场所时候，要注意以下7点：1、尽量不外出，如外出须戴好口罩。在人流密集处，如机场、火车站，最好每2-4小时更换一次。2、避免多次转车，查阅好目的地气温，准备合适衣物。3、尽量不摸门把手、扶手、电梯按钮等物品，触摸后不要摸脸、鼻子和嘴，最好戴上手套。4、勤洗手，尤其进食前、接触脸部前、上厕所后、被呼吸道分泌物污染后，若无清水可用干洗洗手液或消毒棉片。5、尽量少去医院，如有必要应佩戴口罩。6、注意办公室通风，通风可以减少空气中的病毒数量，从而减少感染。7、外出乘地铁、公交等公共交通回家后，要及时换掉外套，洗手、洗鼻。沈阳市卫生健康服务与行政执法中心（沈阳市疾病预防控制中心）供稿,无,无,2020-01-25 23:53,微博 weibo.com,3,1,0
IraXPBMjA,Z_笑的多甜,3201906870, 看着媒体的各种报道听着坊间一些传言一例例新增新冠肺炎患者那么多医护人员奔赴前线太不容易了国难面前万众一心心情有点沉重所尽之力绵薄一定要保护好自己和家人朋友啊不给国家添麻烦不慌不怕对国家有信心中国加油🇨🇳 ,无,无,2020-01-25 23:53,nova5Pro人像超级夜景,0,0,0
IraXPk6wX,逛着脚丫,2754197103,在我印象中年初一下雨的日子真的是可以说是十年前了吧？一直在家不出门刷一整天新闻都是新冠状的，整个人都抑郁了，胸口闷！这个新年过得人心惶惶。 ,无,无,2020-01-25 23:53,iPhone客户端,0,0,5
IraXP1zOd,卑微一枝花,5124418503,我在看：【全国确诊309例新型病例 其中湖北270例】  全国确诊309例新型病例 其中湖北270例 ,无,无,2020-01-25 23:53,新浪新闻客户端,0,0,0
IraXOt37h,仙女仙女小仙女7,6417879153, 全国响应一级预警，第一年不能在家过年，奔赴在工作岗位，亲临医院防控。也会害怕，也会不想离开家，责任重大，每一个人都是这场无形硝烟的战士，请大家相信我们，相信每一个还在工作岗位的工作人员，不信谣，不传谣，积极配合国家响应，就是对防控工作最大的支持。作为一名卫生监督工作人员，作为一名医生家属，我坚信，待到春暖花开之时，我们一起回家。若有战，召必回，愿天佑中华。大家加油！,无,无,2020-01-25 23:53,iPhone客户端,0,0,0
IraXOqKPy,Strawbooty_Q,1445992170,今日饭拍图[这是今天唯一能让我忘记的事了] ,无,无,2020-01-25 23:53,Android,22,4,7
IraXOqKvF,镇彝威微生活,6288923859,我发表了头条文章:《昭通市发现一例新型冠状病毒疑似感染病例》 昭通市发现一例新型冠状病毒疑似感染病例  昭通·镇雄县 ,无,无,2020-01-25 23:53,HUAWEI Mate 20 Pro,1,0,1
IraXOpTAp,Byeoy,3626885680,好的收到！昨天打麻将输了60   今天说的让我往回霍.狗屁又输了40幸好自摸一把赚了60.要不然？？？碰了就听口是啥乱七八糟的操作什么杠后自摸一人20啥！！！？！！唉幸好.幸好.他们中午意识到肺炎的严重性这些钱不白花武汉加油.中国加油.我们加油.嘿嘿. ,无,无,2020-01-25 23:53,小米9,0,0,0
IraXObqeL,大海6795骑马游览杭州湾跨海大桥,3962685976,大海6795骑马游览杭州湾跨海大桥来投稿发表文章： 【河南防意识有多强？外孙拜年被姥爷关门外：我就想自己过年！】河南宣传防护有多厉害？就是，姥爷都不要外孙了，隔着门让外孙把东西放门外，并一个劲让他赶紧走，给东西也靠“空投”……这个视频建议大家让家人都看看！微评：增强疫情防范意识，这个视频值得大家多转。春节期间，大家都在家里呆着吧，就不要出去拜年了。  【大海题】,无,无,2020-01-25 23:53,河南超话,0,0,0
IraXNi2hV,11自然醒哦,5859754579,按时长大，平安喜乐,无,无,2020-01-25 23:53,vivo智能手机,1,0,1
IraXNfJ0l,听堂FM,1796086707,"【需要你的帮助！四川大学华西医院接受社会捐赠公告】 自新型冠状病毒引发的疫情出现以来，四川大学华西医院冲在疫情防控的第一线，各部门互联互通，众志成城，齐心协力要打赢这场抗击新冠的攻坚战！由于华西医院每日患者就诊量大，医务人员众多，为做好每个就诊环节防护，为更好地保障疫情防治需要，保护一线医务人员, 医院将开通接受捐赠渠道, 接受依法合规捐赠的正规渠道、资质齐全的下列防护物资：防护服、隔离衣、防冲击眼罩、防护面罩、N95口罩。部分防护物资(耗材)需符合或高于下列国家标准：医用防护口罩GB19083-2010防护GB19082-2003、GB19082-2009《医用一次性防护服技术要求》以上捐赠物资均需在保质期内，由正规企业生产，包装完好无污损。联系地址:成都市武侯区国学巷37号四川大学华西医院联系人：刘老师 19983137864  王老师 19983137858 如有其他捐赠物资也可与我们联系。联系人：何老师：18980605024",无,无,2020-01-25 23:53,iPhone客户端,2,0,0
IraXNeT7A,固原市生态环境局,5948214310,陈润儿咸辉暗访督查新型冠状病毒感染的疫情防控工作陈润儿咸辉暗访督查新型冠状病毒感染的疫情防控工作 ,无,无,2020-01-25 23:53,HUAWEI P20,0,0,0
IraXNeR27,宕昌公安,2611745777,1月25日，宕昌县公安局网安大队民警在网络巡査中发现，有网友发布有新冠状病毒的患者，已被隔离的信息在微信群被大量转发。警方经核实：截止2020年1月25日14时，宕昌未发现新型冠状病毒感染疫情疑似病例和确诊病例。经审查，违法行为人杨某某对虚构事实扰乱公共秩序的违法行カ供认不讳。 ,无,无,2020-01-25 23:53,iPhone客户端,1,0,0
IraXMlxzK,一条咸鱼样的猫咪,6185733356,『全国新型疫情实时动态 - 丁香园·丁香医生』 ,无,无,2020-01-25 23:53,iPhone客户端,0,0,0
IraXMlwSX,久不见兮湘水茫茫,2928878140,,无,无,2020-01-25 23:53,荣耀20 PRO,0,0,0
IraXM71Mx,我是后脑勺啦_c,3608810503,今天是1月25星期六晚上11:40…今年的春节格外被记忆。从最开始1月初，新闻陆续传出新型肺炎病毒的信息，身边绝大部份人没有在意。大家伙仍旧计划好春节出行的计划，到后来武汉封城，才陆续关注。我所在的城市也因为有当地居民亲属从武汉回来就被感染而人心慌慌。看见一位武汉当地人的日记，不看还好，看了，真的觉得好可怕，尤其是女性朋友，且不说别的，因为你们被封城在内，外面人不知道封城后的模样。没有人辱骂你们武汉人，这个病毒是武汉传出来的，全国人民都在被病毒侵扰。我们当地也从0个感染，到现在居然省内有10多个，口罩断货。虽然很可怕，但是我们要克服，要相信国家，别自己吓自己，吓他人，总会过去的。,无,无,2020-01-25 23:53,iPhone客户端,0,0,0
IraXM6oE3,秋名山老司机藤原富贵,2454337750,2003年小学三年级，那时候全班同学都戴口罩上学，就我死活不愿意带，而且我家离学校还远，每天必须坐公交去学校。那个时候不愿意戴口罩+死活闹着每天要坐公交上学，导致我妈每天早上晚上骑车接送我上学。期间还因为一个小饭桌同学发烧普通在家隔离了好几天才去上学。现在2020年，有点风吹草动就不敢坐公交车和地铁，出门口罩不离身，回家洗手擦酒精唉，总结就一句话：年纪大了就开始惜命了，而且现在还是干啥啥不行，怕死第一名！,无,无,2020-01-25 23:53,富贵牌iPhone X,0,0,1
IraXM3Q2N,途之安者,1879360864,～Z：2003年非典、易感人群为20-37岁青壮年；2020年新型肺炎、易感人群为35-60岁中老年人。仔细一琢磨：这，不是同一波人么？这尼玛是追杀我们啊……,无,无,2020-01-25 23:53,iPhone客户端,0,0,0
IraXLuGBN,Paris陈君兰,5033706886,非常特殊的一个新年没什么新年气氛来拜年的人都在讨论讨论完了赶紧回去然后继续回被窝躺着刷微博关注最新消息生怕附近有确诊病例 ,无,无,2020-01-25 23:53,iPhone客户端,1,0,1
IraXLdEXA,二两羊杂碎,5613355151, 『实时更新|武汉新型全国疫情地图』实时更新|新冠疫情地图 ,无,无,2020-01-25 23:53,HUAWEI P20,0,0,0
IraXLdEH2,战神不败87,6126372282,希望一切都能好起来，希望疫情赶紧得到有效控制，愿所有人平安健康，不要再传染了，真的不想再看到病情扩散的消息了，上帝&释伽牟尼&真主&穆罕默德&菩萨保佑所有人🙏！ ,无,无,2020-01-25 23:53,iPhone客户端,0,0,0
IraXLd0XP,zi子时,5750317314, 希望明天一觉醒来，确诊人数没有再增加,无,无,2020-01-25 23:53,iPhone客户端,0,0,0
IraXLblJQ,用户6351195321,6351195321, 确诊病例破千：为何SARS用了4个月，武汉只用了25天？确诊病例破千：为何SARS用了4个月，武汉只用了25天？ 来自 ,无,无,2020-01-25 23:53,iPhone客户端,0,0,0
IraXLbl3Y,婵菇娘loveyou,1746983542,睡前总是会看很久疫情，不停的互相传染，太难过了。我们的医护人员太了不起了。15号下午我带女儿和妹妹一家三口开车从武汉返回黄冈浠水老家。目前我们都是体温正常，没有发热。但是，前两天村里有太多武汉回来的人。其中还有咳嗽的。甚至还有在除夕武汉封城后偷偷跑回来的。今天大年初一，还到处拜年。不知道隔离吗？我后悔。今天没有关上我家大门。我拒绝他们来我家拜年，可他们还是直冲冲来了我家里。现在真的担心,无,无,2020-01-25 23:53,iPhone客户端,0,0,3
IraXKBXEr,安邦科技福建,1421139613,防控新型疫情，中央决定这场仗这么打！  ,无,无,2020-01-25 23:53,荣耀V20 4800万3D相机,1,0,0
IraXKBXv2,陆婉苏,1246992964,『实时更新|武汉新型全国疫情地图』实时更新|新冠疫情地图 ,无,无,2020-01-25 23:53,HUAWEI P30,0,0,0
IraXKBjfq,弹古论斤,3273453625,真的？假的！国家卫健委专家组成员李兰娟： 新冠答疑10问。真的？假的！国家卫健委专家组成员李兰娟： 新冠答疑10问 ,无,无,2020-01-25 23:53,网易新闻客户端,2,2,1
IraXKzEIN,年底改名儿喇,3538061282,撇开不说，我现在觉得，过年就这样安安静静独处一个小长假多好，大家都在家好好睡觉好好放松，多幸福。当然，还是希望病毒赶紧被消灭掉，国泰民安最重要。 ,无,无,2020-01-25 23:53,iPhone客户端,0,0,0
IraXKkjNU,吃着泡面去青果学院174,6559045254,就像是探戈舞中的一个倒地揽腰的动作，暧昧而充满了戏剧性。 　　刚把她调戏成了这样子，王庸也是不忍心再吃她豆腐了，干净利落的把她托得站了起来。难得很绅士的放开了她的腰。谁知，在这一幕  ,无,无,2020-01-25 23:53,微博 weibo.com,0,0,0
IraXKjDAV,耳边的情话毫,7362314109,后悔是一种耗费精神的情绪。后悔是比损失更大的损失，比错误更大的错误。因此不好后悔  ,无,无,2020-01-25 23:53,微博 weibo.com,0,0,0
IraXKi0HQ,江陵政务,5604006570,江陵县新型冠状病毒感染的疫情防控指挥部通告（第4号） 为进一步贯彻落实国家及省市对新型冠状病毒感染的肺炎疫情防控工作的部署，有效切断病毒传播途径，防止疫情扩散蔓延，确保人民群众生命安全和身体健康，现将有关事项通告如下：自2020年1月26日8时起，全县实行交通管制，关闭辖区内所有高速公路出入口，封闭所有公路进出口通道，含国省道路、县乡道路、村组道路。所有车辆、人员一律禁止通行，涉及疫情防控及民生物资保障车辆除外。请县公安、交通等部门和属地乡镇政府组织实施。恢复时间另行通告。望广大居民、旅客理解支持。,无,无,2020-01-25 23:53,专业版微博,3,3,9
IraXKhZFx,无锡应急,3002137530,【转起来！无锡市人民政府关于实施新型冠状病毒感染的疫情一级响应措施的通告】根据江苏省人民政府关于启动突发公共卫生事件一级响应的决定，为有效遏制新型冠状病毒感染的疫情扩散和蔓延，切实保障人民群众的身体健康和生命安全，无锡市人民政府决定，自2020年1月26日零时起，就突发公共卫生事件实施一级响应防控措施。详情戳：,无,无,2020-01-25 23:53,微博 weibo.com,9,0,5
IraXK1qAH,是似瑾啊,6100513756,一定会好起来的对吗 ,无,无,2020-01-25 23:53,OPPO R9s,0,0,0
IraXJ84VL,叶子不是树上长的是妈妈生的,5622859851, 商人本身就是因为利益存在的，商人也要养家糊口，这是可以理解的。但是在工厂加班加点的按出厂价生产口罩时，销售商爸口罩的价格越飚越高，已经成了“天价” 。在举国对抗病毒时，在一线医护人员用生命和病毒斗争时，你们这样做不会觉得亏心吗？发国难财会安心吗？,无,无,2020-01-25 23:53,nova5Pro人像超级夜景,0,0,0
IraXIwW7S,文氓zikai,6445923780,中国加油❤  我们是最强大的！ 武安市 ,无,#肺炎#,2020-01-25 23:52,中国超话,2,0,0
IraXIeItn,久不见兮湘水茫茫,2928878140,,无,无,2020-01-25 23:52,荣耀20 PRO,0,0,0
IraXIeFNE,油条大哥YU,5948271400,2003的非典有多少人感染？又死了多少人？那时候医疗条件还没有现在的好，那时候的网络没有现在的发达，但是最终全国一心，成功抗击了非典！现在，新型的肺炎在国内多个城市以及全球几个国家蔓延开来！现在的医疗和制药技术，国家各个部门紧密合作，相信要不了几天就会成功遏制住这种新型的病！再大的困难，有国家给我们撑腰！先点个赞！,无,#新型肺炎确诊440例死亡9例#,2020-01-25 23:52,iPhone客户端,0,0,0
IraXHDwuM,温存记忆lym,5789072328, 刚开始还挺担心的，但家人里还是蛮听劝的，奶奶还会告诉其它老人注意防范，三伯也嘱咐年三十回来的儿子注意戴口罩，有个远房亲戚从武汉回来的也自动在家隔离了，家族取消了每年不变的初三聚会，村里也取消了戏剧表演，希望疫情早日得到控制,无,无,2020-01-25 23:52,nova6 5G自拍大不一样,0,0,0
IraXHnHvd,网友阿D,7220020905,吓晕了…… ,无,无,2020-01-25 23:52,iPhone客户端,0,0,0
IraXHlkEq,紫藤蓝嫣,3322293232,全力防控新型 昆明三道防线严防疫情发展 全力防控新型 昆明三道防线严防疫情发展 ,无,无,2020-01-25 23:52,学习强国客户端,0,0,0
IraXGbZAW,湖北医家人,7091526133, ,无,无,2020-01-25 23:52,vivo X23全息幻彩,1,0,0
